--
-- PostgreSQL database dump
--

-- Dumped from database version 9.6.19
-- Dumped by pg_dump version 9.6.19

SET statement_timeout = 0;
SET lock_timeout = 0;
SET idle_in_transaction_session_timeout = 0;
SET client_encoding = 'UTF8';
SET standard_conforming_strings = on;
SELECT pg_catalog.set_config('search_path', '', false);
SET check_function_bodies = false;
SET xmloption = content;
SET client_min_messages = warning;
SET row_security = off;

--
-- Name: DATABASE "SupportAssistant_Reporting"; Type: COMMENT; Schema: -; Owner: postgres
--

COMMENT ON DATABASE "SupportAssistant_Reporting" IS 'Support Assistant Reporting';


--
-- Name: plpgsql; Type: EXTENSION; Schema: -; Owner: 
--

CREATE EXTENSION IF NOT EXISTS plpgsql WITH SCHEMA pg_catalog;


--
-- Name: EXTENSION plpgsql; Type: COMMENT; Schema: -; Owner: 
--

COMMENT ON EXTENSION plpgsql IS 'PL/pgSQL procedural language';


SET default_tablespace = '';

SET default_with_oids = false;

--
-- Name: application_info; Type: TABLE; Schema: public; Owner: postgres
--

CREATE TABLE public.application_info (
    id text NOT NULL,
    name text NOT NULL
);


ALTER TABLE public.application_info OWNER TO postgres;

--
-- Name: issue_reporting; Type: TABLE; Schema: public; Owner: postgres
--

CREATE TABLE public.issue_reporting (
    id text NOT NULL,
    datetime timestamp without time zone,
    host text,
    ip text,
    app_id text NOT NULL,
    app_version text NOT NULL,
    app_path text,
    app_processid text,
    issue_category text,
    issue_recurrence boolean,
    issue_description text,
    user_email text NOT NULL,
    reported_via text,
    archive_path text,
    sys_user_name text,
    sys_os_name text,
    sys_os_arch text,
    sys_os_version text,
    email_sent_to_support boolean
);


ALTER TABLE public.issue_reporting OWNER TO postgres;

--
-- Name: primary_issue_categories; Type: TABLE; Schema: public; Owner: postgres
--

CREATE TABLE public.primary_issue_categories (
    category_names text NOT NULL
);


ALTER TABLE public.primary_issue_categories OWNER TO postgres;

--
-- Name: user_info; Type: TABLE; Schema: public; Owner: postgres
--

CREATE TABLE public.user_info (
    firstname text,
    lastname text,
    email text NOT NULL,
    phoneno text,
    companyname text,
    site text
);


ALTER TABLE public.user_info OWNER TO postgres;

--
-- Data for Name: application_info; Type: TABLE DATA; Schema: public; Owner: postgres
--

COPY public.application_info (id, name) FROM stdin;
DSPAC	DecisionSpace Production Allocation Client
DSP	DSP
SeismicAnalysis	SeismicAnalysis
DSG	DecisionSpace Geosciences
DS Petrophysics	DS Petrophysics
OW Runtime	OW Runtime
SeisSpace	SeisSpace
Compass	Compass
	
Seismic Analysis	Seismic Analysis
Aries	Aries
\.


--
-- Data for Name: issue_reporting; Type: TABLE DATA; Schema: public; Owner: postgres
--

COPY public.issue_reporting (id, datetime, host, ip, app_id, app_version, app_path, app_processid, issue_category, issue_recurrence, issue_description, user_email, reported_via, archive_path, sys_user_name, sys_os_name, sys_os_arch, sys_os_version, email_sent_to_support) FROM stdin;
SA_H182811_DecisionSpace_Geosciences-07-11-2017_114345	2017-07-11 02:14:54.445	ILINKSYS-313	134.132.119.6	DSG	10ep.2	C:\\Landmark\\DSG10ep.2	9999	Crash	t	Description of the Issue:\r\n\r\n\r\nSteps to Reproduce this issue:\r\n1.\r\n2.\r\n3.\r\n\r\nActual Results:\r\n\r\n\r\nExpected Results:\r\n\r\n\r\nAdditional Information:\r\n\r\n	nnn@mail.com	SupportAssistant-v1.0-GUI	07-11-2017/SA_H182811_DecisionSpace_Geosciences-07-11-2017_114345.zip	H182811	Windows 7	amd64	6.1	t
SA_atariq_DecisionSpace_Geosciences-07-11-2017_012210	2017-07-11 02:23:05.335	ahevlrgs01	172.26.56.23	DSG	10ep.2	/lgc/apps/r5000/DSG10ep.2	2353	Crash	f	Description of the Issue:\n\n\nSteps to Reproduce this issue:\n1.\n2.\n3.\n\nActual Results:\n\n\nExpected Results:\n\n\nAdditional Information:\n\n	pp@oc.com	SupportAssistant-v1.0-GUI	07-11-2017/SA_atariq_DecisionSpace_Geosciences-07-11-2017_012210.zip	atariq	Linux	amd64	2.6.32-504.el6.x86_64	t
SA_H182811_DecisionSpace_Geosciences-07-11-2017_115716	2017-07-11 02:27:59.889	ILINKSYS-313	134.132.119.6	DSG	10ep.2	c:/Landmark/DSG10ep.2			f		nnn@mail.com	SupportAssistant-v1.0-CommandLine	COP/Norway/07-11-2017/SA_H182811_DecisionSpace_Geosciences-07-11-2017_115716.zip	H182811	Windows 7	amd64	6.1	t
SA_atariq_DecisionSpace_Geosciences-07-11-2017_013826	2017-07-11 02:39:21.393	ahevlrgs01	172.26.56.23	DSG	10ep.2	/lgc/apps/r5000/DSG10ep.2/			f		test@aaa.com	SupportAssistant-v1.0-CommandLine	COP/07-11-2017/SA_atariq_DecisionSpace_Geosciences-07-11-2017_013826.zip	atariq	Linux	amd64	2.6.32-504.el6.x86_64	t
SA_atariq_DecisionSpace_Geosciences-07-11-2017_014139	2017-07-11 02:42:32.775	ahevlrgs01	172.26.56.23	DSG	10ep.2	/lgc/apps/r5000/DSG10ep.2/			f		test@aaa.com	SupportAssistant-v1.0-CommandLine	COP/07-11-2017/SA_atariq_DecisionSpace_Geosciences-07-11-2017_014139.zip	atariq	Linux	amd64	2.6.32-504.el6.x86_64	t
SA_H182811_DecisionSpace_Geosciences-07-12-2017_121055	2017-07-12 02:43:35.878	ILINKSYS-313	134.132.119.6	DSG	10ep.3	c:\\Landmark\\DSG10ep.3			f	Description of the Issue:\r\n\r\n\r\nSteps to Reproduce this issue:\r\n1.\r\n2.\r\n3.\r\n\r\nActual Results:\r\n\r\n\r\nExpected Results:\r\n\r\n\r\nAdditional Information:\r\n\r\n	nnn@mail.com	SupportAssistant-v1.0-GUI	07-12-2017/SA_H182811_DecisionSpace_Geosciences-07-12-2017_121055.zip	H182811	Windows 7	amd64	6.1	t
SA_H182811_DecisionSpace_Geosciences-07-12-2017_121738	2017-07-12 02:48:25.459	ILINKSYS-313	134.132.119.6	DSG	10ep.2	C:\\Landmark\\DSG10ep.2		Test	f	Description of the Issue:\r\n\r\n\r\nSteps to Reproduce this issue:\r\n1.\r\n2.\r\n3.\r\n\r\nActual Results:\r\n\r\n\r\nExpected Results:\r\n\r\n\r\nAdditional Information:\r\n\r\n	nnn@mail.com	SupportAssistant-v1.0-GUI	07-12-2017/SA_H182811_DecisionSpace_Geosciences-07-12-2017_121738.zip	H182811	Windows 7	amd64	6.1	t
SA_H182811_DecisionSpace_Geosciences-07-12-2017_122213	2017-07-12 02:52:31.494	ILINKSYS-313	134.132.119.6	DSG	10ep.2	C:\\Landmark\\DSG10ep.2		Hung-up	t	Description of the Issue:\r\n\r\n\r\nSteps to Reproduce this issue:\r\n1.\r\n2.\r\n3.\r\n\r\nActual Results:\r\n\r\n\r\nExpected Results:\r\n\r\n\r\nAdditional Information:\r\n\r\n	nnn@mail.com	SupportAssistant-v1.0-GUI	07-12-2017/SA_H182811_DecisionSpace_Geosciences-07-12-2017_122213.zip	H182811	Windows 7	amd64	6.1	t
SA_H182811_DecisionSpace_Geosciences-07-12-2017_122448	2017-07-12 02:55:10.236	ILINKSYS-313	134.132.119.6	DSG	10ep.2	C:\\Landmark\\DSG10ep.2		Performance	t	Description of the Issue:\r\n\r\n\r\nSteps to Reproduce this issue:\r\n1.\r\n2.\r\n3.\r\n\r\nActual Results:\r\n\r\n\r\nExpected Results:\r\n\r\n\r\nAdditional Information:\r\n\r\n	abdullah.tariq@halliburton.com	SupportAssistant-v1.0-GUI	07-12-2017/SA_H182811_DecisionSpace_Geosciences-07-12-2017_122448.zip	H182811	Windows 7	amd64	6.1	t
SA_atariq_DecisionSpace_Geosciences-07-12-2017_020201	2017-07-12 03:02:36.793	ahevlrgs01	172.26.56.23	DSG	10ep.2	/lgc/apps/r5000/DSG10ep.2		Performance	t	Description of the Issue:\n\n\nSteps to Reproduce this issue:\n1.\n2.\n3.\n\nActual Results:\n\n\nExpected Results:\n\n\nAdditional Information:\n\n	abdullah.tariq@halliburton.com	SupportAssistant-v1.0-GUI	07-12-2017/SA_atariq_DecisionSpace_Geosciences-07-12-2017_020201.zip	atariq	Linux	amd64	2.6.32-504.el6.x86_64	t
SA_atariq_DecisionSpace_Geosciences-07-12-2017_020400	2017-07-12 03:04:29.771	ahevlrgs01	172.26.56.23	DSG	10ep.2	/lgc/apps/r5000/DSG10ep.2			f	Description of the Issue:\n\n\nSteps to Reproduce this issue:\n1.\n2.\n3.\n\nActual Results:\n\n\nExpected Results:\n\n\nAdditional Information:\n\n	abdullah.tariq@halliburton.com	SupportAssistant-v1.0-GUI	07-12-2017/SA_atariq_DecisionSpace_Geosciences-07-12-2017_020400.zip	atariq	Linux	amd64	2.6.32-504.el6.x86_64	t
SA_H182811_DecisionSpace_Geosciences-07-12-2017_123411	2017-07-12 03:04:31.464	ILINKSYS-313	134.132.119.6	DSG	10ep.2	C:\\Landmark\\DSG10ep.2		Performance	t	Description of the Issue:\r\n\r\n\r\nSteps to Reproduce this issue:\r\n1.\r\n2.\r\n3.\r\n\r\nActual Results:\r\n\r\n\r\nExpected Results:\r\n\r\n\r\nAdditional Information:\r\n\r\n	abdullah.tariq@halliburton.com	SupportAssistant-v1.0-GUI	07-12-2017/SA_H182811_DecisionSpace_Geosciences-07-12-2017_123411.zip	H182811	Windows 7	amd64	6.1	t
SA_H100379_DecisionSpace_Geosciences-07-12-2017_091943	2017-07-12 10:20:12.265	MWKS410519	34.150.19.25	DSG	10ep.3	c:\\Landmark\\DSG10ep.3		Crash	t	testing	abdullah.tariq@halliburton.com	SupportAssistant-v1.0-GUI	07-12-2017/SA_H100379_DecisionSpace_Geosciences-07-12-2017_091943.zip	H100379	Windows 7	amd64	6.1	t
SA_H100379_DecisionSpace_Geosciences-07-12-2017_092557	2017-07-12 10:26:43.818	MWKS410519	34.150.19.25	DSG	10ep.3	c:\\Landmark\\DSG10ep.3			f	Description of the Issue:\n\n\nSteps to Reproduce this issue:\n1.\n2.\n3.\n\nActual Results:\n\n\nExpected Results:\n\n\nAdditional Information:\n\n	abdalianj@yahoo.com	SupportAssistant-v1.0-GUI	07-12-2017/SA_H100379_DecisionSpace_Geosciences-07-12-2017_092557.zip	H100379	Windows 7	amd64	6.1	t
SA_h100379_DecisionSpace_Geosciences-07-12-2017_113033	2017-07-12 12:31:13.797	MWKS410519	34.54.6.30	DSG	10ep.3	C:\\Landmark\\DSG10ep.3		Crash	t	testing	abdalianj@yahoo.com	SupportAssistant-v1.0-GUI	07-12-2017/SA_h100379_DecisionSpace_Geosciences-07-12-2017_113033.zip	h100379	Windows 7	amd64	6.1	t
SA_atariq_DecisionSpace_Geosciences-07-12-2017_123037	2017-07-12 13:31:20.556	ahevlrgs01	172.26.56.23	DSG	10ep.3	/lgc/home/atariq/Landmark/DSG10ep.3		Crash	t	test	abdullah.tariq@halliburton.com	SupportAssistant-v1.0-GUI	07-12-2017/SA_atariq_DecisionSpace_Geosciences-07-12-2017_123037.zip	atariq	Linux	amd64	2.6.32-504.el6.x86_64	t
SA_H182811_DecisionSpace_Geosciences-07-13-2017_151520	2017-07-13 05:46:30.049			DSG	10ep.2	C:\\Landmark\\DSG10ep.2			f	Description of the Issue:\r\n\r\n\r\nSteps to Reproduce this issue:\r\n1.\r\n2.\r\n3.\r\n\r\nActual Results:\r\n\r\n\r\nExpected Results:\r\n\r\n\r\nAdditional Information:\r\n\r\n	abdullah.tariq@halliburton.com		07-13-2017/SA_H182811_DecisionSpace_Geosciences-07-13-2017_151520.zip					t
SA_atariq_DecisionSpace_Geosciences-07-13-2017_044830	2017-07-13 05:49:09.398	ahevlrgs01	172.26.56.23	DSG	10ep.2	/lgc/apps/r5000/DSG10ep.2		Performance	t	Description of the Issue:\n\n\nSteps to Reproduce this issue:\n1.\n2.\n3.\n\nActual Results:\n\n\nExpected Results:\n\n\nAdditional Information:\n\n	abdullah.tariq@halliburton.com	SupportAssistant-v1.0-GUI	07-13-2017/SA_atariq_DecisionSpace_Geosciences-07-13-2017_044830.zip	atariq	Linux	amd64	2.6.32-504.el6.x86_64	t
SA_H182811_DecisionSpace_Geosciences-07-13-2017_152205	2017-07-13 05:52:27.875	ILINKSYS-313	134.132.119.6	DSG	10ep.2	C:\\Landmark\\DSG10ep.2			f	Description of the Issue:\r\n\r\n\r\nSteps to Reproduce this issue:\r\n1.\r\n2.\r\n3.\r\n\r\nActual Results:\r\n\r\n\r\nExpected Results:\r\n\r\n\r\nAdditional Information:\r\n\r\n	abdalianj@yahoo.com	SupportAssistant-v1.0-GUI	07-13-2017/SA_H182811_DecisionSpace_Geosciences-07-13-2017_152205.zip	H182811	Windows 7	amd64	6.1	t
34fb2d8e-7219-418d-82af-20c509bb1979	2020-04-27 07:22:49.581								f									f
SA_atariq_DecisionSpace_Geosciences-07-13-2017_045332	2017-07-13 05:54:02.291	ahevlrgs01	172.26.56.23	DSG	10ep.2	/lgc/apps/r5000/DSG10ep.2			f	Description of the Issue:\n\n\nSteps to Reproduce this issue:\n1.\n2.\n3.\n\nActual Results:\n\n\nExpected Results:\n\n\nAdditional Information:\n\n	abdalianj@yahoo.com	SupportAssistant-v1.0-GUI	07-13-2017/SA_atariq_DecisionSpace_Geosciences-07-13-2017_045332.zip	atariq	Linux	amd64	2.6.32-504.el6.x86_64	t
SA_atariq_DecisionSpace_Geosciences-07-13-2017_051603	2017-07-13 06:16:33.52	ahevlrgs01	172.26.56.23	DSG	10ep.2	/lgc/apps/r5000/DSG10ep.2			f	Description of the Issue:\n\n\nSteps to Reproduce this issue:\n1.\n2.\n3.\n\nActual Results:\n\n\nExpected Results:\n\n\nAdditional Information:\n\n	abdalianj@yahoo.com	SupportAssistant-v1.0-GUI	07-13-2017/SA_atariq_DecisionSpace_Geosciences-07-13-2017_051603.zip	atariq	Linux	amd64	2.6.32-504.el6.x86_64	t
SA_h100379_DecisionSpace_Geosciences-07-13-2017_105855	2017-07-13 11:59:46.388	MWKS410519	34.150.16.6	DSG	10ep.3	C:\\Landmark\\DSG10ep.3		Crash	t	This is a test message	abdullah.tariq@halliburton.com	SupportAssistant-v1.0-GUI	07-13-2017/SA_h100379_DecisionSpace_Geosciences-07-13-2017_105855.zip	h100379	Windows 7	amd64	6.1	t
SA_h100379_DecisionSpace_Geosciences-07-13-2017_113332	2017-07-13 12:34:04.579	MWKS410519	34.150.16.6	DSG	10ep.3	C:\\Landmark\\DSG10ep.3			f	testing Halliburton e-mail address	abdullah.tariq@halliburton.com	SupportAssistant-v1.0-GUI	07-13-2017/SA_h100379_DecisionSpace_Geosciences-07-13-2017_113332.zip	h100379	Windows 7	amd64	6.1	t
SA_h100379_DecisionSpace_Geosciences-07-13-2017_113436	2017-07-13 12:35:19.777	MWKS410519	34.150.16.6	DSG	10ep.3	C:\\Landmark\\DSG10ep.3		Hung-up	t	testing yahoo.com (external) e-mail address	abdalianj@yahoo.com	SupportAssistant-v1.0-GUI	07-13-2017/SA_h100379_DecisionSpace_Geosciences-07-13-2017_113436.zip	h100379	Windows 7	amd64	6.1	t
SA_h100379_DecisionSpace_Geosciences-07-13-2017_123853	2017-07-13 13:39:24.19	MWKS410519	34.150.16.6	DSG	10ep.3	C:\\Landmark\\DSG10ep.3		Crash	t	Description of the Issue:\n\n\nSteps to Reproduce this issue:\n1.\n2.\n3.\n\nActual Results:\n\n\nExpected Results:\n\n\nAdditional Information:\n\n	abdalianj@yahoo.com	SupportAssistant-v1.0-GUI	07-13-2017/SA_h100379_DecisionSpace_Geosciences-07-13-2017_123853.zip	h100379	Windows 7	amd64	6.1	t
SA_h100379_DecisionSpace_Geosciences-07-14-2017_064640	2017-07-14 07:50:31.227	MWKS410519	34.35.98.22	DSG	10ep.3	C:\\Landmark\\DSG10ep.3		Crash	t	This is a test. Please discard.	abdalianj@yahoo.com	SupportAssistant-v1.0-GUI	07-14-2017/SA_h100379_DecisionSpace_Geosciences-07-14-2017_064640.zip	h100379	Windows 7	amd64	6.1	t
SA_h100379_DecisionSpace_Geosciences-07-17-2017_134243	2017-07-17 14:43:34.83	MWKS410519	34.150.19.175	DSG	10ep.3	C:\\Landmark\\DSG10ep.3		Hung-up	t	Description of the Issue:\n\n\nSteps to Reproduce this issue:\n1.\n2.\n3.\n\nActual Results:\n\n\nExpected Results:\n\n\nAdditional Information:\n\n	abdullah.tariq@halliburton.com	SupportAssistant-v1.0-GUI	07-17-2017/SA_h100379_DecisionSpace_Geosciences-07-17-2017_134243.zip	h100379	Windows 7	amd64	6.1	t
SA_H182811_DecisionSpace_Geosciences-07-18-2017_134545	2017-07-18 04:16:11.413	ILINKSYS-313	134.132.119.6	DSG	10ep.2	C:\\Landmark\\DSG10ep.2		Performance	f	Description of the Issue:\r\n\r\n\r\nSteps to Reproduce this issue:\r\n1.\r\n2.\r\n3.\r\n\r\nActual Results:\r\n\r\n\r\nExpected Results:\r\n\r\n\r\nAdditional Information:\r\n\r\n	abdalianj@yahoo.com	SupportAssistant-v1.0-GUI	07-18-2017/SA_H182811_DecisionSpace_Geosciences-07-18-2017_134545.zip	H182811	Windows 7	amd64	6.1	t
SA_atariq_DecisionSpace_Geosciences-07-18-2017_033722	2017-07-18 04:37:59.585	ahevlrgs01	172.26.56.23	DSG	10ep.2	/lgc/apps/r5000/DSG10ep.2		Hung-up	t	Description of the Issue:\n\n\nSteps to Reproduce this issue:\n1.\n2.\n3.\n\nActual Results:\n\n\nExpected Results:\n\n\nAdditional Information:\n\n	abdalianj@yahoo.com	SupportAssistant-v1.0-GUI	07-18-2017/SA_atariq_DecisionSpace_Geosciences-07-18-2017_033722.zip	atariq	Linux	amd64	2.6.32-504.el6.x86_64	t
SA_H182811_DecisionSpace_Geosciences-07-18-2017_141157	2017-07-18 04:42:22.281	ILINKSYS-313	134.132.119.6	DSG	10ep.3	c:/Landmark/DSG10ep.3			f		test@cop.com	SupportAssistant-v1.0-CommandLine	COP/Norway/07-18-2017/SA_H182811_DecisionSpace_Geosciences-07-18-2017_141157.zip	H182811	Windows 7	amd64	6.1	t
SA_h100379_DecisionSpace_Geosciences-07-19-2017_132424	2017-07-19 14:25:03.001	MWKS410519	34.150.21.252	DSG	10ep.3	C:\\Landmark\\DSG10ep.3		Crash	t	This is a test message. Please discard and close the case. Thanks!	abdullah.tariq@halliburton.com	SupportAssistant-v1.0-GUI	07-19-2017/SA_h100379_DecisionSpace_Geosciences-07-19-2017_132424.zip	h100379	Windows 7	amd64	6.1	t
SA_H182811_DecisionSpace_Geosciences-07-27-2017_192556	2017-07-27 09:56:34.15	ILINKSYS-313	134.132.119.6	DSG	5000.10.0.04	c:\\Landmark\\DecisionSpace5000.10.0.04			f	Description of the Issue:\n\n\nSteps to Reproduce this issue:\n1.\n2.\n3.\n\nActual Results:\n\n\nExpected Results:\n\n\nAdditional Information:\n\n	test@test.com	SupportAssistant-v1.0-GUI	07-27-2017/SA_H182811_DecisionSpace_Geosciences-07-27-2017_192556.zip	H182811	Windows 7	amd64	6.1	t
SA_H182811_DecisionSpace_Geosciences-07-27-2017_192907	2017-07-27 09:59:40.37	ILINKSYS-313	134.132.119.6	DSG	5000.10.0.04	c:\\Landmark\\DecisionSpace5000.10.0.04			f	Description of the Issue:\n\n\nSteps to Reproduce this issue:\n1.\n2.\n3.\n\nActual Results:\n\n\nExpected Results:\n\n\nAdditional Information:\n\n	test@test.com	SupportAssistant-v1.0-GUI	07-27-2017/SA_H182811_DecisionSpace_Geosciences-07-27-2017_192907.zip	H182811	Windows 7	amd64	6.1	t
SA_H182811_DecisionSpace_Geosciences-07-27-2017_193150	2017-07-27 10:02:22.942	ILINKSYS-313	134.132.119.6	DSG	5000.10.0.04	c:\\Landmark\\DecisionSpace5000.10.0.04		Crash	f	Description of the Issue:\n\n\nSteps to Reproduce this issue:\n1.\n2.\n3.\n\nActual Results:\n\n\nExpected Results:\n\n\nAdditional Information:\n\n	test@test.com	SupportAssistant-v1.0-GUI	07-27-2017/SA_H182811_DecisionSpace_Geosciences-07-27-2017_193150.zip	H182811	Windows 7	amd64	6.1	t
SA_H182811_DecisionSpace_Geosciences-07-27-2017_193630	2017-07-27 10:07:04.064	ILINKSYS-313	134.132.119.6	DSG	5000.10.0.04	c:\\Landmark\\DecisionSpace5000.10.0.04			f	Description of the Issue:\n\n\nSteps to Reproduce this issue:\n1.\n2.\n3.\n\nActual Results:\n\n\nExpected Results:\n\n\nAdditional Information:\n\n	test@test.com	SupportAssistant-v1.0-GUI	07-27-2017/SA_H182811_DecisionSpace_Geosciences-07-27-2017_193630.zip	H182811	Windows 7	amd64	6.1	t
SA_H182811_DecisionSpace_Geosciences-07-27-2017_194010	2017-07-27 10:10:46.208	ILINKSYS-313	134.132.119.6	DSG	5000.10.0.04	c:\\Landmark\\DecisionSpace5000.10.0.04		Performance	f	Description of the Issue:\n\n\nSteps to Reproduce this issue:\n1.\n2.\n3.\n\nActual Results:\n\n\nExpected Results:\n\n\nAdditional Information:\n\n	test@test.com	SupportAssistant-v1.0-GUI	07-27-2017/SA_H182811_DecisionSpace_Geosciences-07-27-2017_194010.zip	H182811	Windows 7	amd64	6.1	t
SA_H182811_DecisionSpace_Geosciences-07-27-2017_194125	2017-07-27 10:11:57.609	ILINKSYS-313	134.132.119.6	DSG	5000.10.0.04	c:\\Landmark\\DecisionSpace5000.10.0.04			f	Description of the Issue:\n\n\nSteps to Reproduce this issue:\n1.\n2.\n3.\n\nActual Results:\n\n\nExpected Results:\n\n\nAdditional Information:\n\n	test@test.com	SupportAssistant-v1.0-GUI	07-27-2017/SA_H182811_DecisionSpace_Geosciences-07-27-2017_194125.zip	H182811	Windows 7	amd64	6.1	t
SA_H182811_DecisionSpace_Geosciences-07-27-2017_194428	2017-07-27 10:15:01.457	ILINKSYS-313	134.132.119.6	DSG	5000.10.0.04	c:\\Landmark\\DecisionSpace5000.10.0.04		Performance	f	Description of the Issue:\n\n\nSteps to Reproduce this issue:\n1.\n2.\n3.\n\nActual Results:\n\n\nExpected Results:\n\n\nAdditional Information:\n\n	test@test.com	SupportAssistant-v1.0-GUI	07-27-2017/SA_H182811_DecisionSpace_Geosciences-07-27-2017_194428.zip	H182811	Windows 7	amd64	6.1	t
ce70da1f-f41b-4c5a-97ad-2c767bd96d1c	2020-04-27 07:27:56.378								f									f
SA_H182811_DecisionSpace_Geosciences-07-27-2017_194900	2017-07-27 10:19:37.195	ILINKSYS-313	134.132.119.6	DSG	5000.10.0.04	c:\\Landmark\\DecisionSpace5000.10.0.04			f	Description of the Issue:\n\n\nSteps to Reproduce this issue:\n1.\n2.\n3.\n\nActual Results:\n\n\nExpected Results:\n\n\nAdditional Information:\n\n	test@test.com	SupportAssistant-v1.0-GUI	07-27-2017/SA_H182811_DecisionSpace_Geosciences-07-27-2017_194900.zip	H182811	Windows 7	amd64	6.1	t
SA_atariq_DecisionSpace_Geosciences-07-27-2017_092452	2017-07-27 10:25:48.867	ahevlrgs01	172.26.56.23	DSG	10ep.2	/lgc/apps/r5000/DSG10ep.2			f	Description of the Issue:\n\n\nSteps to Reproduce this issue:\n1.\n2.\n3.\n\nActual Results:\n\n\nExpected Results:\n\n\nAdditional Information:\n\n	abdalianj@yahoo.com	SupportAssistant-v1.0-GUI	07-27-2017/SA_atariq_DecisionSpace_Geosciences-07-27-2017_092452.zip	atariq	Linux	amd64	2.6.32-504.el6.x86_64	t
SA_H182811_DecisionSpace_Geosciences-07-27-2017_200354	2017-07-27 10:35:20.143	ILINKSYS-313	134.132.119.6	DSG	5000.10.0.04	c:\\Landmark\\DecisionSpace5000.10.0.04		Hung-up	f	Description of the Issue:\n\n\nSteps to Reproduce this issue:\n1.\n2.\n3.\n\nActual Results:\n\n\nExpected Results:\n\n\nAdditional Information:\n\n	test@test.com	SupportAssistant-v1.0-GUI	07-27-2017/SA_H182811_DecisionSpace_Geosciences-07-27-2017_200354.zip	H182811	Windows 7	amd64	6.1	t
SA_H100379_DecisionSpace_Geosciences-07-27-2017_093609	2017-07-27 10:36:54.735	MWKS410519	34.150.20.83	DSG	10ep.3	C:\\Landmark\\DSG10ep.3			f	Description of the Issue:\n\n\nSteps to Reproduce this issue:\n1.\n2.\n3.\n\nActual Results:\n\n\nExpected Results:\n\n\nAdditional Information:\n\n	abdullah.tariq@halliburton.com	SupportAssistant-v1.0-GUI	07-27-2017/SA_H100379_DecisionSpace_Geosciences-07-27-2017_093609.zip	H100379	Windows 7	amd64	6.1	t
SA_blomm1_DecisionSpace_Geosciences-07-28-2017_105322	2017-07-28 11:55:21.911	RHEL66-30.BPL48.R1P1.IENERGYCLOUD.SOLUTIONS	10.215.129.30	DSG	10ep.3	/apps/DSG10ep3.5.1		Crash	f	Description of the Issue:\nDSG Crash when refreshing a framework.  \n\nSteps to Reproduce this issue:\n1.\n2.\n3.\n\nActual Results:\n\n\nExpected Results:\n\n\nAdditional Information:\n\nI was in Anadarko All Data, refreshing framework BrownDolomite	margaret.blome@bp.com	SupportAssistant-v1.0-GUI	07-28-2017/SA_blomm1_DecisionSpace_Geosciences-07-28-2017_105322.zip	blomm1	Linux	amd64	2.6.32-504.el6.x86_64	t
SA_H182811_DecisionSpace_Geosciences-07-31-2017_150509	2017-07-31 05:36:37.02	ILINKSYS-313	134.132.119.6	DSG	5000.10.0.04	c:\\Landmark\\DecisionSpace5000.10.0.04			f	Description of the Issue:\r\n\r\n\r\nSteps to Reproduce this issue:\r\n1.\r\n2.\r\n3.\r\n\r\nActual Results:\r\n\r\n\r\nExpected Results:\r\n\r\n\r\nAdditional Information:\r\n\r\n	test@test.com	SupportAssistant-v1.0-GUI	07-31-2017/SA_H182811_DecisionSpace_Geosciences-07-31-2017_150509.zip	H182811	Windows 7	amd64	6.1	t
SA_stacyb_DecisionSpace_Geosciences-07-31-2017_141637	2017-07-31 15:22:46.057	ho48lw1001.conocophillips.net	158.139.58.155	DSG	10ep.3	/apps/ow516b/DSG/10ep.3.05.1		Testing Support Assistant	f	Description of the Issue:\n\nIGNORE THIS. We are testing Support Assistant. \nYou may close this case.\n\nSteps to Reproduce this issue:\n1.\n2.\n3.\n\nActual Results:\n\n\nExpected Results:\n\n\nAdditional Information:\n\n	bart.stacy@conocophillips.com	SupportAssistant-v1.0-GUI	07-31-2017/SA_stacyb_DecisionSpace_Geosciences-07-31-2017_141637.zip	stacyb	Linux	amd64	2.6.32-696.el6.x86_64	t
SA_murths_DecisionSpace_Geosciences-08-02-2017_145351	2017-08-02 15:58:35.291	hotrlw63	158.139.32.163	DSG	10ep.4	/apps/ow516b/DSG/10ep.4.03b3		Crash	t	Description of the Issue:\nDSG crashes when another instance of DSG launching in different workspace\n\nSteps to Reproduce this issue:\n1. Launch DSG in Workspace -1 and open a session and display Seismic data / any object in editors\n2. Launch DSG in Workspace -2 and try to open / create a new session\n\nResult: \n\nActual Results:\nDSG crashes!!  Tryed at least 4 times, and in all times it crashes!\n\nExpected Results:\nDSG should not crash!\n\nAdditional Information:\nLinux environment\n	sriram.murthy@halliburton.com	SupportAssistant-v1.0-GUI	08-02-2017/SA_murths_DecisionSpace_Geosciences-08-02-2017_145351.zip	murths	Linux	amd64	2.6.32-696.el6.x86_64	t
SA_H182811_DecisionSpace_Geosciences-08-03-2017_155240	2017-08-03 06:23:19.716	ILINKSYS-313	134.132.119.6	DSG	10ep.2	C:\\Landmark\\DSG10ep.2		Stability	f	Description of the Issue:\n\n\nSteps to Reproduce this issue:\n1.\n2.\n3.\n\nActual Results:\n\n\nExpected Results:\n\n\nAdditional Information:\n\n	test@test.com	SupportAssistant-v1.0-GUI	08-03-2017/SA_H182811_DecisionSpace_Geosciences-08-03-2017_155240.zip	H182811	Windows 7	amd64	6.1	t
SA_H182811_DecisionSpace_Geosciences-08-03-2017_163416	2017-08-03 07:04:56.998	ILINKSYS-313	134.132.119.6	DSG	G1_10ep.4	C:\\Landmark\\DSG10epG1		Performance	t	Description of the Issue:\r\n\r\n\r\nSteps to Reproduce this issue:\r\n1.\r\n2.\r\n3.\r\n\r\nActual Results:\r\n\r\n\r\nExpected Results:\r\n\r\n\r\nAdditional Information:\r\n\r\n	test@test.com	SupportAssistant-v1.0-GUI	08-03-2017/SA_H182811_DecisionSpace_Geosciences-08-03-2017_163416.zip	H182811	Windows 7	amd64	6.1	t
SA_estaple_DecisionSpace_Geosciences-08-03-2017_090711	2017-08-03 13:10:40.062	protanto.conocophillips.net	10.25.124.45	DSG	10ep.3	/apps/ow513/DSG/10ep.3.05.1		Crash	f	Description of the Issue:\nI was in cube view and went to put it in TVD and the entire session blew away and this screen popped up.\n\nSteps to Reproduce this issue:\n1.Load a Time-Depth conversion model\n2.Load a volume into shared memory\n3.Bring the shared memory volume in as a slice\n4.Change the cube view from TWT to TVD\n\nActual Results:\n\n\nExpected Results:\n\n\nAdditional Information:\n\n	evan.staples@cop.com	SupportAssistant-v1.0-GUI	08-03-2017/SA_estaple_DecisionSpace_Geosciences-08-03-2017_090711.zip	estaple	Linux	amd64	2.6.32-696.el6.x86_64	t
SA_ramirmi_DecisionSpace_Geosciences-08-03-2017_200202	2017-08-04 00:07:16.915	amarone.conocophillips.net	10.25.106.74	DSG	10ep.3	/apps/ow513/DSG/10ep.3.05.1		Crash	f	Description of the Issue: DSG shut down following attempt at loading Framework\n\n\nSteps to Reproduce this issue:\n1. Create Copy of Framework\n2. Load copy of Framework to current sesions\n3. Fail\n\nActual Results: DSG crashed\n\n\nExpected Results: DSG doesnt crash and I load the framework copy and work on it\n\n\nAdditional Information:\n\n	marina.i.ramirez@conocophillips.com	SupportAssistant-v1.0-GUI	08-03-2017/SA_ramirmi_DecisionSpace_Geosciences-08-03-2017_200202.zip	ramirmi	Linux	amd64	2.6.32-573.1.1.el6.x86_64	t
SA_H182811_DecisionSpace_Geosciences-08-04-2017_144135	2017-08-04 05:12:15.781	ILINKSYS-313	134.132.119.6	DSG	10ep.3	c:/Landmark/DSG10ep.3			f		sacmdline@lsa.com	SupportAssistant-v1.0-CommandLine	COP/Norway/08-04-2017/SA_H182811_DecisionSpace_Geosciences-08-04-2017_144135.zip	H182811	Windows 7	amd64	6.1	t
SA_HBL2452_DecisionSpace_Geosciences-08-08-2017_111727	2017-08-08 12:27:40.909	MWKS425586	34.194.50.19	DSG	10ep.3	C:\\Landmark\\DSG10ep.3		Documentation	f	Description of the Issue:\n\n\nSteps to Reproduce this issue:\n1.\n2.\n3.\n\nActual Results:\n\n\nExpected Results:\n\n\nAdditional Information:\n\n	alejandro.islas2@halliburton.com	SupportAssistant-v1.0-GUI	08-08-2017/SA_HBL2452_DecisionSpace_Geosciences-08-08-2017_111727.zip	HBL2452	Windows 7	amd64	6.1	t
SA_atariq_DecisionSpace_Geosciences-08-10-2017_022133	2017-08-10 03:23:08.472	ahevlrgs01	172.26.56.23	DSG	10ep.2	/lgc/apps/r5000/DSG10ep.2			f	Description of the Issue:\n\n\nSteps to Reproduce this issue:\n1.\n2.\n3.\n\nActual Results:\n\n\nExpected Results:\n\n\nAdditional Information:\n\n	abdalianj@yahoo.com	SupportAssistant-v1.0-GUI	08-10-2017/SA_atariq_DecisionSpace_Geosciences-08-10-2017_022133.zip	atariq	Linux	amd64	2.6.32-504.el6.x86_64	t
d5f8011a-6409-4b4d-bda1-bc32a95a1006	2020-04-27 07:34:12.982								f									f
SA_atariq_DecisionSpace_Geosciences-08-10-2017_023156	2017-08-10 03:33:43.502	ahevlrgs01	172.26.56.23	DSG	10ep.2	/lgc/apps/r5000/DSG10ep.2			f	Description of the Issue:\n\n\nSteps to Reproduce this issue:\n1.\n2.\n3.\n\nActual Results:\n\n\nExpected Results:\n\n\nAdditional Information:\n\n	abdalianj@yahoo.com	SupportAssistant-v1.0-GUI	08-10-2017/SA_atariq_DecisionSpace_Geosciences-08-10-2017_023156.zip	atariq	Linux	amd64	2.6.32-504.el6.x86_64	t
SA_atariq_DecisionSpace_Geosciences-08-10-2017_042116	2017-08-10 05:22:34.132	ahevlrgs01	172.26.56.23	DSG	10ep.3.05	/Landmark/DSG10ep.3			f	Description of the Issue:\n\n\nSteps to Reproduce this issue:\n1.\n2.\n3.\n\nActual Results:\n\n\nExpected Results:\n\n\nAdditional Information:\n\n	aaa@bbb.ccc	SupportAssistant-v1.0-GUI	08-10-2017/SA_atariq_DecisionSpace_Geosciences-08-10-2017_042116.zip	atariq	Linux	amd64	2.6.32-504.el6.x86_64	t
SA_HBL3409_DecisionSpace_Geosciences-08-10-2017_112009	2017-08-10 12:21:21.105	mwks427097	34.150.22.119	DSG	10ep.3	C:\\Landmark\\DSG10E~1.2_G			f	Description of the Issue:\n\n\nSteps to Reproduce this issue:\n1.\n2.\n3.\n\nActual Results:\n\n\nExpected Results:\n\n\nAdditional Information:\n\n	l.j.wieting@halliburton.com	SupportAssistant-v1.0-GUI	08-10-2017/SA_HBL3409_DecisionSpace_Geosciences-08-10-2017_112009.zip	HBL3409	Windows 10	amd64	10.0	t
SA_H123780_DecisionSpace_Geosciences-08-10-2017_143722	2017-08-10 15:38:44.919	MWKSVA7E5C9	34.150.18.170	DSG	10ep.3	C:\\Landmark\\DSG10E~1.01_		Stability	f	Description of the Issue:\r\n\r\nHi!\r\n\r\nSteps to Reproduce this issue:\r\n1.\r\n2.\r\n3.\r\n\r\nActual Results:\r\n\r\n\r\nExpected Results:\r\n\r\n\r\nAdditional Information:\r\n\r\n	marie.knappenberger@halliburton.com	SupportAssistant-v1.0-GUI	08-10-2017/SA_H123780_DecisionSpace_Geosciences-08-10-2017_143722.zip	H123780	Windows 7	amd64	6.1	t
SA_H178743_DecisionSpace_Geosciences-08-10-2017_142910	2017-08-10 15:39:38.583	MWK100004	34.54.50.172	DSG	10ep.3	C:\\Landmark\\DSG10E~1.305			f	Description of the Issue:\r\nCrash:  While doing Seismic Well tie analysis and in parallel laoding the volume into Shared memory\r\n\r\nSteps to Reproduce this issue:\r\n1. Launched Norway project\r\n2. Displayed the wells which has DT and Rhob\r\n3. Selected a Well which has DT and RHOB logs available launched the Well Tie Analysis application\r\n4. While doing the WSF workflow (to select a Seismic data), using add data selected a Volume (Fusion survey) and added the Seismic data into inventory tree\r\n5. Displayed the volume (inline, Xline, Time) in Cube\r\n6. Tried to load the volume in Shared memory\r\n\r\nActual Results:\r\n\r\n\r\nExpected Results:\r\nIt should load the volume into shared memory\r\n\r\n\r\nAdditional Information:\r\n\r\nIt crashed!!	sriram.murthy@halliburton.com	SupportAssistant-v1.0-GUI	08-10-2017/SA_H178743_DecisionSpace_Geosciences-08-10-2017_142910.zip	H178743	Windows 7	amd64	6.1	t
SA_atariq_DecisionSpace_Geosciences-08-11-2017_031202	2017-08-11 04:13:53.815	ahevlrgs01	172.26.56.23	DSG	10ep.2	/Landmark/DSG10ep.2			f	Description of the Issue:\n\n\nSteps to Reproduce this issue:\n1.\n2.\n3.\n\nActual Results:\n\n\nExpected Results:\n\n\nAdditional Information:\n\n	aaa@bbb.ccc	SupportAssistant-v1.0-GUI	08-11-2017/SA_atariq_DecisionSpace_Geosciences-08-11-2017_031202.zip	atariq	Linux	amd64	2.6.32-504.el6.x86_64	t
SA_atariq_DecisionSpace_Geosciences-08-11-2017_031450	2017-08-11 04:15:47.825	ahevlrgs01	172.26.56.23	DSG	10ep.2	/Landmark/DSG10ep.2			f	Description of the Issue:\n\n\nSteps to Reproduce this issue:\n1.\n2.\n3.\n\nActual Results:\n\n\nExpected Results:\n\n\nAdditional Information:\n\n	aaa@bbb.ccc	SupportAssistant-v1.0-GUI	08-11-2017/SA_atariq_DecisionSpace_Geosciences-08-11-2017_031450.zip	atariq	Linux	amd64	2.6.32-504.el6.x86_64	t
SA_h100379_DecisionSpace_Geosciences-08-14-2017_133847	2017-08-14 14:40:35.809	MWKS410519	192.168.1.3	DSG	10ep.3.05	c:\\Landmark\\DSG10ep.3			f	Description of the Issue:\n\n\nSteps to Reproduce this issue:\n1.\n2.\n3.\n\nActual Results:\n\n\nExpected Results:\n\n\nAdditional Information:\n\n	abdullah.tariq@halliburton.com	SupportAssistant-v1.0-GUI	08-14-2017/SA_h100379_DecisionSpace_Geosciences-08-14-2017_133847.zip	h100379	Windows 7	amd64	6.1	t
SA_atorres_DecisionSpace_Geosciences-08-14-2017_155201	2017-08-14 17:07:10.484	hotclw1702.conocophillips.net	158.139.59.12	DSG	10ep.3	/apps/ow516b/DSG/10ep.3.05.2			f	Description of the Issue:\nRemove the platform and workspace folders. Loaded an Iset called 'Share memory".\nCubeView became unresponsive, MapView was working.\nLoaded in Mapview a Horizon, trying to zoom in, DSG crashed\n\nSteps to Reproduce this issue:\n1.\n2.\n3.\n\nActual Results:\n\n\nExpected Results:\n\n\nAdditional Information:\n\n	antonio.torres@cop.com	SupportAssistant-v1.0-GUI	08-14-2017/SA_atorres_DecisionSpace_Geosciences-08-14-2017_155201.zip	atorres	Linux	amd64	2.6.32-573.1.1.el6.x86_64	t
SA_atorres_DecisionSpace_Geosciences-08-14-2017_172523	2017-08-14 18:33:12.343	hotclw1702.conocophillips.net	158.139.59.12	DSG	10ep.3	/apps/ow513/DSG/10ep.3.05.1			t	Description of the Issue:\nCrashed when trying to Open an existing session\n\nSteps to Reproduce this issue:\n1. Open an existing session\n2. Wiat to open\n3. Crashed\n\nActual Results:\n\n\nExpected Results:\n\n\nAdditional Information:\n\n	antonio.torres@cop.com	SupportAssistant-v1.0-GUI	08-14-2017/SA_atorres_DecisionSpace_Geosciences-08-14-2017_172523.zip	atorres	Linux	amd64	2.6.32-573.1.1.el6.x86_64	t
SA_H182811_DecisionSpace_Geosciences-08-16-2017_120220	2017-08-16 02:33:42.877	ILINKSYS-313	134.132.119.6	DSG	10ep.3	C:\\Landmark\\DSG10ep.3		Performance	f	Description of the Issue:\r\n\r\n\r\nSteps to Reproduce this issue:\r\n1.\r\n2.\r\n3.\r\n\r\nActual Results:\r\n\r\n\r\nExpected Results:\r\n\r\n\r\nAdditional Information:\r\n\r\n	test@test.com	SupportAssistant-v1.0-GUI	08-16-2017/SA_H182811_DecisionSpace_Geosciences-08-16-2017_120220.zip	H182811	Windows 7	amd64	6.1	t
SA_H182811_DecisionSpace_Geosciences-08-16-2017_141523	2017-08-16 04:47:17.103	ILINKSYS-313	134.132.119.6	DSG	5000.10.0.04	c:\\Landmark\\DecisionSpace5000.10.0.04			f	Description of the Issue:\r\n\r\n\r\nSteps to Reproduce this issue:\r\n1.\r\n2.\r\n3.\r\n\r\nActual Results:\r\n\r\n\r\nExpected Results:\r\n\r\n\r\nAdditional Information:\r\n\r\n	test@test.com	SupportAssistant-v1.0-GUI	08-16-2017/SA_H182811_DecisionSpace_Geosciences-08-16-2017_141523.zip	H182811	Windows 7	amd64	6.1	t
SA_H182811_DecisionSpace_Geosciences-08-16-2017_141726	2017-08-16 04:48:23.008	ILINKSYS-313	134.132.119.6	DSG	10ep.3.05	c:\\Landmark\\DSG10ep.3			f	Description of the Issue:\n\n\nSteps to Reproduce this issue:\n1.\n2.\n3.\n\nActual Results:\n\n\nExpected Results:\n\n\nAdditional Information:\n\n	test@test.com	SupportAssistant-v1.0-GUI	08-16-2017/SA_H182811_DecisionSpace_Geosciences-08-16-2017_141726.zip	H182811	Windows 7	amd64	6.1	t
SA_atariq_DecisionSpace_Geosciences-08-16-2017_034903	2017-08-16 04:50:17.319	ahevlrgs01	172.26.56.23	DSG	10ep.3.05	/Landmark/DSG10ep.3			f	Description of the Issue:\n\n\nSteps to Reproduce this issue:\n1.\n2.\n3.\n\nActual Results:\n\n\nExpected Results:\n\n\nAdditional Information:\n\n	test@test.com	SupportAssistant-v1.0-GUI	08-16-2017/SA_atariq_DecisionSpace_Geosciences-08-16-2017_034903.zip	atariq	Linux	amd64	2.6.32-504.el6.x86_64	t
SA_h182930_DecisionSpace_Geosciences-08-16-2017_142420	2017-08-16 04:57:27.762	ILINKSYS-324	134.132.119.7	DSG	10ep.2	C:\\Landmark\\DSG10ep.2			f	Description of the Issue:\n\n\nSteps to Reproduce this issue:\n1.\n2.\n3.\n\nActual Results:\n\n\nExpected Results:\n\n\nAdditional Information:\n\n	kavink@test.com	SupportAssistant-v1.0-GUI	08-16-2017/SA_h182930_DecisionSpace_Geosciences-08-16-2017_142420.zip	h182930	Windows 7	amd64	6.1	f
SA_h100379_DecisionSpace_Geosciences-01-02-2018_140304	2018-01-02 15:06:44.233	MWKS410519	34.54.6.218	DSG	10ep.3	C:\\Landmark\\DSG10ep.3			f	This is a test case. Please ignore. Thanks!	abdullah.tariq@halliburton.com	SupportAssistant-v1.0-GUI	01-02-2018/SA_h100379_DecisionSpace_Geosciences-01-02-2018_140304.zip	h100379	Windows 7	amd64	6.1	t
SA_h182930_DecisionSpace_Geosciences-08-16-2017_142845	2017-08-16 05:01:12.814	ILINKSYS-324	134.132.119.7	DSG	10ep.3.05	c:\\Landmark\\DSG10ep.3			f	Description of the Issue:\n\n\nSteps to Reproduce this issue:\n1.\n2.\n3.\n\nActual Results:\n\n\nExpected Results:\n\n\nAdditional Information:\n\n	kavink@test.com	SupportAssistant-v1.0-GUI	08-16-2017/SA_h182930_DecisionSpace_Geosciences-08-16-2017_142845.zip	h182930	Windows 7	amd64	6.1	f
SA_H182811_DecisionSpace_Geosciences-08-16-2017_142955	2017-08-16 05:05:54.997	ILINKSYS-313	134.132.119.6	DSG	10ep.3.05	c:\\Landmark\\DSG10ep.3			f	Description of the Issue:\n\n\nSteps to Reproduce this issue:\n1.\n2.\n3.\n\nActual Results:\n\n\nExpected Results:\n\n\nAdditional Information:\n\n	test@test.com	SupportAssistant-v1.0-GUI	08-16-2017/SA_H182811_DecisionSpace_Geosciences-08-16-2017_142955.zip	H182811	Windows 7	amd64	6.1	f
SA_H182811_DecisionSpace_Geosciences-08-16-2017_143801	2017-08-16 05:09:02.998	ILINKSYS-313	134.132.119.6	DSG	10ep.3.05	c:\\Landmark\\DSG10ep.3			f	Description of the Issue:\n\n\nSteps to Reproduce this issue:\n1.\n2.\n3.\n\nActual Results:\n\n\nExpected Results:\n\n\nAdditional Information:\n\n	test@test.com	SupportAssistant-v1.0-GUI	08-16-2017/SA_H182811_DecisionSpace_Geosciences-08-16-2017_143801.zip	H182811	Windows 7	amd64	6.1	f
SA_h182930_DecisionSpace_Geosciences-08-16-2017_151110	2017-08-16 05:44:51.707	ILINKSYS-324	134.132.119.7	DSG	10ep.2	C:\\Landmark\\DSG10ep.2			f	Description of the Issue:\n\n\nSteps to Reproduce this issue:\n1.\n2.\n3.\n\nActual Results:\n\n\nExpected Results:\n\n\nAdditional Information:\n\n	kavink@test.com	SupportAssistant-v1.0-GUI	08-16-2017/SA_h182930_DecisionSpace_Geosciences-08-16-2017_151110.zip	h182930	Windows 7	amd64	6.1	t
SA_H182811_DecisionSpace_Geosciences-08-16-2017_171515	2017-08-16 07:46:11.165	ILINKSYS-313	134.132.119.6	DSG	10ep.2.04	C:\\Landmark\\DSG10ep.3		Killed	f	Description of the Issue:\r\n\r\n\r\nSteps to Reproduce this issue:\r\n1.\r\n2.\r\n3.\r\n\r\nActual Results:\r\n\r\n\r\nExpected Results:\r\n\r\n\r\nAdditional Information:\r\n\r\n	test@test.com	SupportAssistant-v1.0-GUI	08-16-2017/SA_H182811_DecisionSpace_Geosciences-08-16-2017_171515.zip	H182811	Windows 7	amd64	6.1	t
SA_h100379_DecisionSpace_Geosciences-08-16-2017_075227	2017-08-16 08:53:23.307	MWKS410519	34.150.21.81	DSG	G1_10ep.3	C:\\Landmark\\DSG10epG1			f	Description of the Issue:\n\n\nSteps to Reproduce this issue:\n1.\n2.\n3.\n\nActual Results:\n\n\nExpected Results:\n\n\nAdditional Information:\n\n	abdullah.tariq@halliburton.com	SupportAssistant-v1.0-GUI	08-16-2017/SA_h100379_DecisionSpace_Geosciences-08-16-2017_075227.zip	h100379	Windows 7	amd64	6.1	t
SA_h100379_DecisionSpace_Geosciences-08-16-2017_080145	2017-08-16 09:02:42.813	MWKS410519	34.150.21.81	DSG	G1_10ep.3	C:\\Landmark\\DSG10epG1		Crash	t	Description of the Issue:\n\n\nSteps to Reproduce this issue:\n1.\n2.\n3.\n\nActual Results:\n\n\nExpected Results:\n\n\nAdditional Information:\n\n	abdullah.tariq@halliburton.com	SupportAssistant-v1.0-GUI	08-16-2017/SA_h100379_DecisionSpace_Geosciences-08-16-2017_080145.zip	h100379	Windows 7	amd64	6.1	t
SA_atorres_DecisionSpace_Geosciences-08-16-2017_080515	2017-08-16 10:19:30.53	ho48lw0609.conocophillips.net	158.139.58.99	DSG	10ep.3	/apps/ow516b/DSG/10ep.3.05.2		Crash	t	Description of the Issue:\n\nI saved a session with multiple share memory volume, saved and tried to open, but DSG crashed\n\nSteps to Reproduce this issue:\n1.Create a session with multiple share volume files\n2.Save the session\n3.Try to open the session\n\nActual Results:\n\n\nExpected Results:\n\n\nAdditional Information:\n\n	antonio.torres@cop.com	SupportAssistant-v1.0-GUI	08-16-2017/SA_atorres_DecisionSpace_Geosciences-08-16-2017_080515.zip	atorres	Linux	amd64	2.6.32-573.1.1.el6.x86_64	t
SA_h100379_DecisionSpace_Geosciences-08-16-2017_135423	2017-08-16 14:55:44.37	MWKS410519	34.150.23.48	DSG	10ep.3	c:\\Landmark\\DSG10ep.3			f	testing	abdullah.tariq@halliburton.com	SupportAssistant-v1.0-GUI	08-16-2017/SA_h100379_DecisionSpace_Geosciences-08-16-2017_135423.zip	h100379	Windows 7	amd64	6.1	t
SA_h100379_DecisionSpace_Geosciences-08-17-2017_011447	2017-08-17 02:16:28.927			DSG	10ep.3	c:\\Landmark\\DSG10ep.3			f	Description of the Issue:\n\n\nSteps to Reproduce this issue:\n1.\n2.\n3.\n\nActual Results:\n\n\nExpected Results:\n\n\nAdditional Information:\n\n	test@test.com		08-17-2017/SA_h100379_DecisionSpace_Geosciences-08-17-2017_011447.zip					t
SA_h100379_DecisionSpace_Geosciences-08-17-2017_013112	2017-08-17 02:32:47.611	MWKS425542	34.54.7.196	DSG	10ep.3.05	c:\\Landmark\\DSG10ep.3			f	Description of the Issue:\n\n\nSteps to Reproduce this issue:\n1.\n2.\n3.\n\nActual Results:\n\n\nExpected Results:\n\n\nAdditional Information:\n\n	test@test.com	SupportAssistant-v1.0-GUI	08-17-2017/SA_h100379_DecisionSpace_Geosciences-08-17-2017_013112.zip	h100379	Windows 7	amd64	6.1	t
SA_h100379_DecisionSpace_Geosciences-08-17-2017_091203	2017-08-17 10:13:21.663	MWKS410519	34.150.19.126	DSG	10ep.3.05	c:\\Landmark\\DSG10ep.3			f	This is a test.	abdullah.tariq@halliburton.com	SupportAssistant-v1.0-GUI	08-17-2017/SA_h100379_DecisionSpace_Geosciences-08-17-2017_091203.zip	h100379	Windows 7	amd64	6.1	t
SA_atariq_DecisionSpace_Geosciences-08-17-2017_155131	2017-08-17 16:52:35.951	ahevlrgs01	172.26.56.23	DSG	10ep.2	/Landmark/DSG10ep.2		Crash	t	Description of the Issue:\n\n\nSteps to Reproduce this issue:\n1.\n2.\n3.\n\nActual Results:\n\n\nExpected Results:\n\n\nAdditional Information:\n\n	test@test.com	SupportAssistant-v1.0-GUI	08-17-2017/SA_atariq_DecisionSpace_Geosciences-08-17-2017_155131.zip	atariq	Linux	amd64	2.6.32-504.el6.x86_64	t
SA_atariq_DecisionSpace_Geosciences-08-18-2017_011536	2017-08-18 02:16:50.422	ahevlrgs01	172.26.56.23	DSG	10ep.3.05	/Landmark/DSG10ep.3			f	Description of the Issue:\n\n\nSteps to Reproduce this issue:\n1.\n2.\n3.\n\nActual Results:\n\n\nExpected Results:\n\n\nAdditional Information:\n\n	abdullah.tariq@halliburton.com	SupportAssistant-v1.0-GUI	08-18-2017/SA_atariq_DecisionSpace_Geosciences-08-18-2017_011536.zip	atariq	Linux	amd64	2.6.32-504.el6.x86_64	t
SA_ow50_DecisionSpace_Geosciences-08-22-2017_105555	2017-08-22 12:00:21.462	moclx83.hux.murphyoilcorp.com	10.200.109.83	DSG	10ep.3	/apps/linux/Landmark/DSG10ep3.05		Crash	f	Description of the Issue:\nI was creating a Search Query for Log Curves exist and Has Any surface picks with the initials MCM. I toggled on display child results table, clicked Run, and the software crashed. \n\nSteps to Reproduce this issue:\n1. Open Search\n2. Create query with Log curves and has any surface picks and chose a bunch of surface picks (>30)\n3.Click Run\n\nActual Results: crashed\n\n\nExpected Results: Runs a search query\n\n\nAdditional Information:\n\n	amanda.peters@halliburton.com	SupportAssistant-v1.0-GUI	08-22-2017/SA_ow50_DecisionSpace_Geosciences-08-22-2017_105555.zip	ow50	Linux	amd64	2.6.32-696.3.1.el6.x86_64	t
SA_murths_DecisionSpace_Geosciences-08-22-2017_132042	2017-08-22 14:25:49.046	hotrlw63	158.139.32.163	DSG	10ep.3	/apps/ow516b/DSG/10ep.3.05.2		Crash	f	Description of the Issue:\nWhile displaying Inline and Crossline probes, the system gets crashed!\n\nSteps to Reproduce this issue:\n1. Display Wells in Map and Cube editor\n2. Tried to display Inline and Cross line probe in Cube editor (not shared memory)\n3. DSG crashed!\n\nActual Results:\n\n\nExpected Results:\n\n\nAdditional Information:\n\n	sriram.murthy@halliburton.com	SupportAssistant-v1.0-GUI	08-22-2017/SA_murths_DecisionSpace_Geosciences-08-22-2017_132042.zip	murths	Linux	amd64	2.6.32-696.el6.x86_64	t
SA_H182811_DecisionSpace_Geosciences-08-23-2017_115853	2017-08-23 02:30:27.825	ILINKSYS-313	134.132.119.6	DSG	10ep.3.05	c:\\Landmark\\DSG10ep.3			f	Description of the Issue:\n\n\nSteps to Reproduce this issue:\n1.\n2.\n3.\n\nActual Results:\n\n\nExpected Results:\n\n\nAdditional Information:\n\n	test@test.com	SupportAssistant-v1.0-GUI	08-23-2017/SA_H182811_DecisionSpace_Geosciences-08-23-2017_115853.zip	H182811	Windows 7	amd64	6.1	t
SA_H182811_DecisionSpace_Geosciences-08-23-2017_121107	2017-08-23 02:42:20.865	ILINKSYS-313	134.132.119.6	DSG	10ep.3.05	c:\\Landmark\\DSG10ep.3			f	Description of the Issue:\n\n\nSteps to Reproduce this issue:\n1.\n2.\n3.\n\nActual Results:\n\n\nExpected Results:\n\n\nAdditional Information:\n\n	test@test.com	SupportAssistant-v1.0-GUI	08-23-2017/SA_H182811_DecisionSpace_Geosciences-08-23-2017_121107.zip	H182811	Windows 7	amd64	6.1	t
SA_H100379_DecisionSpace_Geosciences-08-23-2017_102537	2017-08-23 11:26:52.672	MWKS410519	34.150.20.149	DSG	10ep.3.05.2	C:\\Landmark\\DSG10epG1		Hung-up	t	test	test@test.com	SupportAssistant-v1.0-GUI	08-23-2017/SA_H100379_DecisionSpace_Geosciences-08-23-2017_102537.zip	H100379	Windows 7	amd64	6.1	t
SA_atariq_DecisionSpace_Geosciences-08-23-2017_124541	2017-08-23 13:46:51.791	ahevlrgs01	172.26.56.23	DSG	10ep.3.05	/Landmark/DSG10ep.3			f	test	test@test.com	SupportAssistant-v1.0-GUI	08-23-2017/SA_atariq_DecisionSpace_Geosciences-08-23-2017_124541.zip	atariq	Linux	amd64	2.6.32-504.el6.x86_64	t
SA_atariq_DecisionSpace_Geosciences-08-23-2017_130607	2017-08-23 14:07:26.827	ahevlrgs01	172.26.56.23	DSG	10ep.3.05	/Landmark/DSG10ep.3			f	Description of the Issue:\n\n\nSteps to Reproduce this issue:\n1.\n2.\n3.\n\nActual Results:\n\n\nExpected Results:\n\n\nAdditional Information:\n\n	test@test.com	SupportAssistant-v1.0-GUI	08-23-2017/SA_atariq_DecisionSpace_Geosciences-08-23-2017_130607.zip	atariq	Linux	amd64	2.6.32-504.el6.x86_64	t
SA_H100379_DecisionSpace_Geosciences-08-23-2017_130842	2017-08-23 14:10:28.284	MWKS410519	34.150.20.149	DSG	10ep.3.05.2	C:\\Landmark\\DSG10epG1			f	Description of the Issue:\n\n\nSteps to Reproduce this issue:\n1.\n2.\n3.\n\nActual Results:\n\n\nExpected Results:\n\n\nAdditional Information:\n\n	test@test.com	SupportAssistant-v1.0-GUI	08-23-2017/SA_H100379_DecisionSpace_Geosciences-08-23-2017_130842.zip	H100379	Windows 7	amd64	6.1	t
SA_atariq_DecisionSpace_Geosciences-08-24-2017_045442	2017-08-24 05:55:52.813	ahevlrgs01	172.26.56.23	DSG	10ep.3.05	/Landmark/DSG10ep.3			f	Description of the Issue:\n\n\nSteps to Reproduce this issue:\n1.\n2.\n3.\n\nActual Results:\n\n\nExpected Results:\n\n\nAdditional Information:\n\n	test@test.com	SupportAssistant-v1.0-GUI	08-24-2017/SA_atariq_DecisionSpace_Geosciences-08-24-2017_045442.zip	atariq	Linux	amd64	2.6.32-504.el6.x86_64	t
SA_h100379_DecisionSpace_Geosciences-08-24-2017_100420	2017-08-24 11:05:34.339	MWKS410519	34.150.20.149	DSG	10ep.3.05.2	c:\\Landmark\\DSG10ep.3		Crash	t	Test	test@test.com	SupportAssistant-v1.0-GUI	08-24-2017/SA_h100379_DecisionSpace_Geosciences-08-24-2017_100420.zip	h100379	Windows 7	amd64	6.1	t
SA_h100379_DecisionSpace_Geosciences-08-24-2017_104630	2017-08-24 11:47:39.568	MWKS410519	34.150.20.149	DSG	10ep.3.05.2	c:\\Landmark\\DSG10ep.3		Crash	t	Description of the Issue:\n\n\nSteps to Reproduce this issue:\n1.\n2.\n3.\n\nActual Results:\n\n\nExpected Results:\n\n\nAdditional Information:\n\n	test@test.com	SupportAssistant-v1.0-GUI	08-24-2017/SA_h100379_DecisionSpace_Geosciences-08-24-2017_104630.zip	h100379	Windows 7	amd64	6.1	t
SA_h100379_DecisionSpace_Geosciences-08-24-2017_104833	2017-08-24 11:49:40.94	MWKS410519	34.150.20.149	DSG	10ep.3.05.2	c:\\Landmark\\DSG10ep.3			f	Description of the Issue:\n\n\nSteps to Reproduce this issue:\n1.\n2.\n3.\n\nActual Results:\n\n\nExpected Results:\n\n\nAdditional Information:\n\n	a@b.com	SupportAssistant-v1.0-GUI	08-24-2017/SA_h100379_DecisionSpace_Geosciences-08-24-2017_104833.zip	h100379	Windows 7	amd64	6.1	t
SA_h100379_DecisionSpace_Geosciences-08-28-2017_091459	2017-08-28 10:16:12.046	MWKS410519	10.192.70.142	DSG	10ep.3.05	c:\\Landmark\\DSG10ep.3			f	Description of the Issue:\n\n\nSteps to Reproduce this issue:\n1.\n2.\n3.\n\nActual Results:\n\n\nExpected Results:\n\n\nAdditional Information:\n\n	a@b.com	SupportAssistant-v1.0-GUI	08-28-2017/SA_h100379_DecisionSpace_Geosciences-08-28-2017_091459.zip	h100379	Windows 7	amd64	6.1	t
SA_atariq_DecisionSpace_Geosciences-08-28-2017_103338	2017-08-28 11:34:52.885	ahevlrgs01	172.26.56.23	DSG	10ep.3.05	/Landmark/DSG10ep.3			f	Description of the Issue:\n\n\nSteps to Reproduce this issue:\n1.\n2.\n3.\n\nActual Results:\n\n\nExpected Results:\n\n\nAdditional Information:\n\n	test@test.com	SupportAssistant-v1.0-GUI	08-28-2017/SA_atariq_DecisionSpace_Geosciences-08-28-2017_103338.zip	atariq	Linux	amd64	2.6.32-504.el6.x86_64	t
SA_atariq_DecisionSpace_Geosciences-08-28-2017_103435	2017-08-28 11:35:49.593	ahevlrgs01	172.26.56.23	DSG	10ep.3.05	/Landmark/DSG10ep.3			f	Description of the Issue:\n\n\nSteps to Reproduce this issue:\n1.\n2.\n3.\n\nActual Results:\n\n\nExpected Results:\n\n\nAdditional Information:\n\n	test@test.com	SupportAssistant-v1.0-GUI	08-28-2017/SA_atariq_DecisionSpace_Geosciences-08-28-2017_103435.zip	atariq	Linux	amd64	2.6.32-504.el6.x86_64	t
SA_H182930_DecisionSpace_Geosciences-08-30-2017_112204	2017-08-30 01:55:59.953	ILINKSYS-324	134.132.119.7	DSG	10ep.2	C:\\Landmark\\DSG10ep.2			f	Description of the Issue:\r\n\r\n\r\nSteps to Reproduce this issue:\r\n1.\r\n2.\r\n3.\r\n\r\nActual Results:\r\n\r\n\r\nExpected Results:\r\n\r\n\r\nAdditional Information:\r\n\r\n	kavink@test.com	SupportAssistant-v1.0-GUI	08-30-2017/SA_H182930_DecisionSpace_Geosciences-08-30-2017_112204.zip	H182930	Windows 7	amd64	6.1	t
SA_h100379_DecisionSpace_Geosciences-08-30-2017_120537	2017-08-30 13:07:32.727	MWKS410519	10.192.67.203	DSG	10ep.3.05	c:\\Landmark\\DSG10ep.3			f	Description of the Issue:\n\n\nSteps to Reproduce this issue:\n1.\n2.\n3.\n\nActual Results:\n\n\nExpected Results:\n\n\nAdditional Information:\n\n	a@b.com	SupportAssistant-v1.0-GUI	08-30-2017/SA_h100379_DecisionSpace_Geosciences-08-30-2017_120537.zip	h100379	Windows 7	amd64	6.1	t
SA_H182811_DecisionSpace_Geosciences-08-31-2017_133328	2017-08-31 04:04:37.104	ILINKSYS-313	134.132.119.6	DSG	10ep.3.05	c:\\Landmark\\DSG10ep.3			f	Description of the Issue:\r\n\r\n\r\nSteps to Reproduce this issue:\r\n1.\r\n2.\r\n3.\r\n\r\nActual Results:\r\n\r\n\r\nExpected Results:\r\n\r\n\r\nAdditional Information:\r\n\r\n	test@test.com	SupportAssistant-v1.0-GUI	08-31-2017/SA_H182811_DecisionSpace_Geosciences-08-31-2017_133328.zip	H182811	Windows 7	amd64	6.1	t
SA_zamansm_DecisionSpace_Geosciences-08-31-2017_143551	2017-08-31 15:39:38.3	hotcenmb05.conocophillips.net	158.139.152.50	DSG	10ep.3	/apps/ow513/DSG/10ep.3.05.1		Crash	f	Description of the Issue:\n\n\nSteps to Reproduce this issue:\n1. Connected to the OW District (OHOR5P11)\n2. Launched DSG 3.05\n3. Splash screen appeared on display and stayed 1.25 mins and the cashed.\n\nActual Results:\n\n\nExpected Results:\n\n\nAdditional Information:\n\n	shah.m.zaman@conocophillips.com	SupportAssistant-v1.0-GUI	08-31-2017/SA_zamansm_DecisionSpace_Geosciences-08-31-2017_143551.zip	zamansm	Linux	amd64	2.6.32-696.el6.x86_64	t
SA_H182930_DecisionSpace_Geosciences-09-07-2017_151554	2017-09-07 05:49:15.67	ILINKSYS-324	134.132.119.7	DSG	10ep.3.05	c:\\Landmark\\DSG10ep.3			f	Description of the Issue:\n\n\nSteps to Reproduce this issue:\n1.\n2.\n3.\n\nActual Results:\n\n\nExpected Results:\n\n\nAdditional Information:\n\n	kavink@test.com	SupportAssistant-v1.0-GUI	09-07-2017/SA_H182930_DecisionSpace_Geosciences-09-07-2017_151554.zip	H182930	Windows 7	amd64	6.1	t
62547ac5-ed81-400a-b28a-4d1ba23b6f35	2017-09-07 05:52:16.826								f									f
SA_atariq_DecisionSpace_Geosciences-09-07-2017_051417	2017-09-07 06:15:41.121	ahevlrgs01	172.26.56.23	DSG	10ep.3.05	/Landmark/DSG10ep.3			f	Description of the Issue:\n\n\nSteps to Reproduce this issue:\n1.\n2.\n3.\n\nActual Results:\n\n\nExpected Results:\n\n\nAdditional Information:\n\n	test@test.com	SupportAssistant-v1.0-GUI	09-07-2017/SA_atariq_DecisionSpace_Geosciences-09-07-2017_051417.zip	atariq	Linux	amd64	2.6.32-504.el6.x86_64	t
SA_atariq_DecisionSpace_Geosciences-09-07-2017_051500	2017-09-07 06:16:27.188	ahevlrgs01	172.26.56.23	DSG	10ep.3.05	/Landmark/DSG10ep.3			f	Description of the Issue:\n\n\nSteps to Reproduce this issue:\n1.\n2.\n3.\n\nActual Results:\n\n\nExpected Results:\n\n\nAdditional Information:\n\n	test@test.com	SupportAssistant-v1.0-GUI	09-07-2017/SA_atariq_DecisionSpace_Geosciences-09-07-2017_051500.zip	atariq	Linux	amd64	2.6.32-504.el6.x86_64	t
SA_H182930_DecisionSpace_Geosciences-09-08-2017_154616	2017-09-08 06:29:47.334	ILINKSYS-324	134.132.119.7	DSG	10ep.3.05	c:\\Landmark\\DSG10ep.3			f	Description of the Issue:\n\n\nSteps to Reproduce this issue:\n1.\n2.\n3.\n\nActual Results:\n\n\nExpected Results:\n\n\nAdditional Information:\n\n	kavink@test.com	SupportAssistant-v1.0-GUI	09-08-2017/SA_H182930_DecisionSpace_Geosciences-09-08-2017_154616.zip	H182930	Windows 7	amd64	6.1	t
SA_hbl3835_DecisionSpace_Geosciences-09-08-2017_142357	2017-09-08 15:27:45.869	WKS099914	34.54.50.83	DSG	10ep.3	F:\\DS\\DSCF6F~1		Hung-up	f	Description of the Issue:\r\nAttempted to see the point which were included in my new G&C\r\n\r\nSteps to Reproduce this issue:\r\n1.  Make a grid with a horizon and a well pick\r\n2.Save to OW\r\n3.MB3 in inventory and select a point display\r\n\r\nActual Results:\r\nApp stops working\r\n\r\nExpected Results:\r\n\r\n\r\nAdditional Information:\r\n\r\n	rwagner@lgc.com	SupportAssistant-v1.0-GUI	09-08-2017/SA_hbl3835_DecisionSpace_Geosciences-09-08-2017_142357.zip	hbl3835	Windows 7	amd64	6.1	t
SA_H182811_DecisionSpace_Geosciences-09-14-2017_135237	2017-09-14 04:25:34.113	ILINKSYS-313	134.132.119.6	DSG	10ep.2	C:\\Landmark\\DSG10ep.2			f	Description of the Issue:\r\n\r\n\r\nSteps to Reproduce this issue:\r\n1.\r\n2.\r\n3.\r\n\r\nActual Results:\r\n\r\n\r\nExpected Results:\r\n\r\n\r\nAdditional Information:\r\n\r\n	test@test.com	SupportAssistant-v1.0-GUI	09-14-2017/SA_H182811_DecisionSpace_Geosciences-09-14-2017_135237.zip	H182811	Windows 7	amd64	6.1	t
SA_H123780_DecisionSpace_Geosciences-09-15-2017_154505	2017-09-15 16:55:00.744			DSG	10ep.4	C:\\Landmark\\DSG10ep.4			f	Description of the Issue:\r\n\r\n\r\nSteps to Reproduce this issue:\r\n1.\r\n2.\r\n3.\r\n\r\nActual Results:\r\n\r\n\r\nExpected Results:\r\n\r\n\r\nAdditional Information:\r\n\r\nDiagnostic Assistant Report\r\nGenerated on: 09/15/2017 15:47:04\r\n\r\nDiagnostic Assistant Build 10.0.0.20170609130750-b8c3fa09f4\r\n\r\n\r\n----------------------------------------------------------------------\r\nGraphics\r\n----------------------------------------------------------------------\r\nVendor NVIDIA Corporation is supported.\r\nCard Quadro K5000M/PCIe/SSE2 is supported.\r\nCheck with your laptop manufacturer for the specified driver.Profile set to recommended profile.\r\n\r\n	marie.knappenberger@halliburton.com		09-15-2017/SA_H123780_DecisionSpace_Geosciences-09-15-2017_154505.zip					t
SA_chh791_DecisionSpace_Geosciences-09-18-2017_143310	2017-09-18 15:50:31.466	C256775DP	10.49.16.63	DSG	10ep.3	C:\\Landmark\\DSG10ep3.05.2			f	Description of the Issue:\r\nDSG froze while switching perspectives\r\n\r\nSteps to Reproduce this issue:\r\n1.\r\n2.\r\n3.\r\n\r\nActual Results:\r\n\r\n\r\nExpected Results:\r\n\r\n\r\nAdditional Information:\r\n\r\n	callie.anderson@anadarko.com	SupportAssistant-v1.0-GUI	09-18-2017/SA_chh791_DecisionSpace_Geosciences-09-18-2017_143310.zip	chh791	Windows 10	amd64	10.0	t
SA_en29722_DecisionSpace_Geosciences-09-21-2017_144237	2017-09-21 08:44:13.252	t4vaf0200c-0b.ad04.eni.intranet	10.110.134.174	DSG	10ep.3	/sw/vaf/lgc/DecisionSpace/10ep.3.05.2			f	Description of the Issue:\n\n\nSteps to Reproduce this issue:\n1.\n2.\n3.\n\nActual Results:\n\n\nExpected Results:\n\n\nAdditional Information:\n\n	a.b@c.com	SupportAssistant-v1.0-GUI	09-21-2017/SA_en29722_DecisionSpace_Geosciences-09-21-2017_144237.zip	en29722	Linux	amd64	2.6.32-642.el6.x86_64	t
SA_en29722_DecisionSpace_Geosciences-09-21-2017_144406	2017-09-21 08:45:27.373	t4vaf0200c-0b.ad04.eni.intranet	10.110.134.174	DSG	10ep.3	/sw/vaf/lgc/DecisionSpace/10ep.3.05.2			f	Description of the Issue:\n\n\nSteps to Reproduce this issue:\n1.\n2.dfqwdqdq\n3.\n\nActual Results:\n\n\nExpected Results:\n\n\nAdditional Information:\n\n	a.b@c.com	SupportAssistant-v1.0-GUI	09-21-2017/SA_en29722_DecisionSpace_Geosciences-09-21-2017_144406.zip	en29722	Linux	amd64	2.6.32-642.el6.x86_64	t
SA_en29722_DecisionSpace_Geosciences-09-21-2017_144526	2017-09-21 08:47:04.931	t4vaf0200c-0b.ad04.eni.intranet	10.110.134.174	DSG	10ep.3	/sw/vaf/lgc/DecisionSpace/10ep.3.05.2		Crash	t	Description of the Issue:\nQWDQwd\n\nSteps to Reproduce this issue:\n1.QWDQWD\n2.WD\tWD\n3.wd\twd\n\nActual Results:\nqwdqwd\n\nExpected Results:\nwdsd\n\nAdditional Information:\n\nqDQWDQWD	a.b@c.com	SupportAssistant-v1.0-GUI	09-21-2017/SA_en29722_DecisionSpace_Geosciences-09-21-2017_144526.zip	en29722	Linux	amd64	2.6.32-642.el6.x86_64	t
SA_en29722_DecisionSpace_Geosciences-09-21-2017_145346	2017-09-21 09:26:38.29	t4vaf0200c-0b.ad04.eni.intranet	10.110.134.174	DSG	10ep.3	/sw/vaf/lgc/DecisionSpace/10ep.3.05.2			f	Description of the Issue:\n\n\nSteps to Reproduce this issue:\n1.\n2.\n3.\n\nActual Results:\n\n\nExpected Results:\n\n\nAdditional Information:\n\n	a.b@c.com	SupportAssistant-v1.0-GUI	09-21-2017/SA_en29722_DecisionSpace_Geosciences-09-21-2017_145346.zip	en29722	Linux	amd64	2.6.32-642.el6.x86_64	t
SA_en29722_DecisionSpace_Geosciences-09-21-2017_152623	2017-09-21 09:29:20.414	t4vaf0200c-0b.ad04.eni.intranet	10.110.134.174	DSG	10ep.3	/sw/vaf/lgc/DecisionSpace/10ep.3.05.2			f	Description of the Issue:\n\n\nSteps to Reproduce this issue:\n1.\n2.\n3.\n\nActual Results:\n\n\nExpected Results:\n\n\nAdditional Information:\n\n	a.b@c.com	SupportAssistant-v1.0-GUI	09-21-2017/SA_en29722_DecisionSpace_Geosciences-09-21-2017_152623.zip	en29722	Linux	amd64	2.6.32-642.el6.x86_64	t
SA_en29722_DecisionSpace_Geosciences-09-21-2017_152928	2017-09-21 09:30:47.562	t4vaf0200c-0b.ad04.eni.intranet	10.110.134.174	DSG	10ep.3	/sw/vaf/lgc/DecisionSpace/10ep.3.05.2			f	Description of the Issue:\n\n\nSteps to Reproduce this issue:\n1.\n2.\n3.\n\nActual Results:\n\n\nExpected Results:\n\n\nAdditional Information:\n\n	a.b@c.com	SupportAssistant-v1.0-GUI	09-21-2017/SA_en29722_DecisionSpace_Geosciences-09-21-2017_152928.zip	en29722	Linux	amd64	2.6.32-642.el6.x86_64	t
SA_en29722_DecisionSpace_Geosciences-09-21-2017_160747	2017-09-21 10:10:01.758	t4vaf0200c-0b.ad04.eni.intranet	10.110.134.174	DSG	10ep.3	/sw/vaf/lgc/DecisionSpace/10ep.3.05.2			f	Description of the Issue:\n\n\nSteps to Reproduce this issue:\n1.\n2.\n3.\n\nActual Results:\n\n\nExpected Results:\n\n\nAdditional Information:\n\n	ian.gath@halliburton.com	SupportAssistant-v1.0-GUI	09-21-2017/SA_en29722_DecisionSpace_Geosciences-09-21-2017_160747.zip	en29722	Linux	amd64	2.6.32-642.el6.x86_64	t
SA_en29722_DecisionSpace_Geosciences-09-21-2017_160901	2017-09-21 10:10:17.529	t4vaf0200c-0b.ad04.eni.intranet	10.110.134.174	DSG	10ep.3	/sw/vaf/lgc/DecisionSpace/10ep.3.05.2			f	Description of the Issue:\n\n\nSteps to Reproduce this issue:\n1.\n2.\n3.\n\nActual Results:\n\n\nExpected Results:\n\n\nAdditional Information:\n\n	ian.gath@halliburton.com	SupportAssistant-v1.0-GUI	09-21-2017/SA_en29722_DecisionSpace_Geosciences-09-21-2017_160901.zip	en29722	Linux	amd64	2.6.32-642.el6.x86_64	t
SA_en29722_DecisionSpace_Geosciences-09-21-2017_162423	2017-09-21 10:25:36.906	t4vaf0200c-0b.ad04.eni.intranet	10.110.134.174	DSG	10ep.3	/sw/vaf/lgc/DecisionSpace/10ep.3.05.2			f	Description of the Issue:\n\n\nSteps to Reproduce this issue:\n1.\n2.\n3.\n\nActual Results:\n\n\nExpected Results:\n\n\nAdditional Information:\n\n	ian.gath@halliburton.com	SupportAssistant-v1.0-GUI	09-21-2017/SA_en29722_DecisionSpace_Geosciences-09-21-2017_162423.zip	en29722	Linux	amd64	2.6.32-642.el6.x86_64	t
SA_h100379_DecisionSpace_Geosciences-01-02-2018_142631	2018-01-02 15:30:11.15	MWKS410519	34.54.6.218	DSG	10ep.3	C:\\Landmark\\DSG10ep.3			f	This is a test case. Please ignore this. Thanks!\r\n\r\n	abdullah.tariq@halliburton.com	SupportAssistant-v1.0-GUI	01-02-2018/SA_h100379_DecisionSpace_Geosciences-01-02-2018_142631.zip	h100379	Windows 7	amd64	6.1	t
SA_en29722_DecisionSpace_Geosciences-09-21-2017_162602	2017-09-21 10:27:44.914	t4vaf0200c-0b.ad04.eni.intranet	10.110.134.174	DSG	10ep.3	/sw/vaf/lgc/DecisionSpace/10ep.3.05.2			f	Description of the Issue:\n\n\nSteps to Reproduce this issue:\n1.\n2.\n3.\n\nActual Results:\n\n\nExpected Results:\n\n\nAdditional Information:\n\n	ian.gath@halliburton.com	SupportAssistant-v1.0-GUI	09-21-2017/SA_en29722_DecisionSpace_Geosciences-09-21-2017_162602.zip	en29722	Linux	amd64	2.6.32-642.el6.x86_64	t
SA_en29722_DecisionSpace_Geosciences-09-21-2017_164456	2017-09-21 10:46:24.534	t4vaf0200c-0b.ad04.eni.intranet	10.110.134.174	DSG	10ep.3	/sw/vaf/lgc/DecisionSpace/10ep.3.05.2			f	Description of the Issue:\n\n\nSteps to Reproduce this issue:\n1.\n2.\n3.\n\nActual Results:\n\n\nExpected Results:\n\n\nAdditional Information:\n\n	ian.gath@halliburton.com	SupportAssistant-v1.0-GUI	09-21-2017/SA_en29722_DecisionSpace_Geosciences-09-21-2017_164456.zip	en29722	Linux	amd64	2.6.32-642.el6.x86_64	t
SA_no02968_DecisionSpace_Geosciences-09-22-2017_095902	2017-09-22 04:01:29.871	t4vaf0200b-0f.ad04.eni.intranet	10.110.134.180	DSG	10ep.3	/sw/vaf/lgc/DecisionSpace/10ep.3.05.2			f	Description of the Issue:\n\n\nSteps to Reproduce this issue:\n1.\n2.\n3.\n\nActual Results:\n\n\nExpected Results:\n\n\nAdditional Information:\n\n	roberto.damonti@eni.com	SupportAssistant-v1.0-GUI	09-22-2017/SA_no02968_DecisionSpace_Geosciences-09-22-2017_095902.zip	no02968	Linux	amd64	2.6.32-642.el6.x86_64	t
SA_no02968_DecisionSpace_Geosciences-09-22-2017_100057	2017-09-22 04:02:17.64	t4vaf0200b-0f.ad04.eni.intranet	10.110.134.180	DSG	10ep.3	/sw/vaf/lgc/DecisionSpace/10ep.3.05.2			f	Description of the Issue:\n\n\nSteps to Reproduce this issue:\n1.\n2.\n3.\n\nActual Results:\n\n\nExpected Results:\n\n\nAdditional Information:\n\n	roberto.damonti@eni.com	SupportAssistant-v1.0-GUI	09-22-2017/SA_no02968_DecisionSpace_Geosciences-09-22-2017_100057.zip	no02968	Linux	amd64	2.6.32-642.el6.x86_64	t
SA_taylodw_DecisionSpace_Geosciences-09-22-2017_113105	2017-09-22 12:36:21.542	hooflw02.conocophillips.net	158.139.8.102	DSG	10ep.3	/apps/ow513/DSG/10ep.3.05.1			f	Description of the Issue:\ncrashed while merging grids in grid and contour\n\nSteps to Reproduce this issue:\n1.\n2.\n3.\n\nActual Results:\n\n\nExpected Results:\n\n\nAdditional Information:\n\n	duncan.w.taylor@cop.com	SupportAssistant-v1.0-GUI	09-22-2017/SA_taylodw_DecisionSpace_Geosciences-09-22-2017_113105.zip	taylodw	Linux	amd64	2.6.32-573.1.1.el6.x86_64	t
SA_flove_DecisionSpace_Geosciences-09-28-2017_111640	2017-09-28 12:24:39.846	hotrlw63	158.139.32.163	DSG	10ep.3.05.3	/apps/ow516b/DSG/10ep.3.05.3		Crash	t	Description of the Issue:\nCube Crashed During Testing Frank R Love\n\nSteps to Reproduce this issue:\n1.Load Seismic: IL XL Slice\nLoad to Shared Memory 1000-4000 ms\nCreate 3 Cubes\nLoad 2D Data\nDisplay 2D: Cube Froze ~ 5min\nCube Functional\nCube Froze: Select 2D Line\nCube Functional ~ 3min\nSelect 2D Line Cube Froze\nCube functional ~ 2min\nSelect 2D Line Cube Froze\nAdd Damplier 3D Data\nXL IL Slice\nCube Crashed \n\n\nActual Results:\nLoaded Significant Number of 2D Lines, Horizons, Shapefiles, Polygons, 3 Box Cubes\n\nExpected Results:\n\n\nAdditional Information:\n\n	frank.love@halliburton.com	SupportAssistant-v1.0-GUI	09-28-2017/SA_flove_DecisionSpace_Geosciences-09-28-2017_111640.zip	flove	Linux	amd64	2.6.32-696.el6.x86_64	t
SA_flove_DecisionSpace_Geosciences-09-28-2017_113631	2017-09-28 12:38:37.431	hotrlw63	158.139.32.163	DSG	10ep.3.05.3	/apps/ow516b/DSG/10ep.3.05.3			f	Description of the Issue:\n\n\nSteps to Reproduce this issue:\n1.\n2.\n3.\n\nActual Results:\n\n\nExpected Results:\n\n\nAdditional Information:\n\n	frank.love@halliburton.com	SupportAssistant-v1.0-GUI	09-28-2017/SA_flove_DecisionSpace_Geosciences-09-28-2017_113631.zip	flove	Linux	amd64	2.6.32-696.el6.x86_64	t
SA_HBL2455_DecisionSpace_Geosciences-10-02-2017_093324	2017-10-02 11:45:25.353	MWKS423138	134.132.140.59	DSG	10ep.4	C:\\Landmark\\DSG10ep.4		DSR appeared out of the blue.	f	Description of the Issue:\r\nIn the Devon dataset.  Loaded All wells and created search query for wells with picks and log curves. then using well details ring fenced a group of wells.  Saves as well list.\r\nRemoved the ALL wells and the inmemory pointset using MB3 remove from session.\r\nand then the DSR appeared\r\n\r\nSteps to Reproduce this issue:\r\n1. Launch DSG, select all wells\r\n2. Use Active Project Search to find wells with Surface picks and Log Curves\r\n3. then list wells in Well details (from Map View).\r\n4. Ring fence the wells in video i just recorded.  They are in the NW of the data set\r\n5. Save well list from well details ALPA_Field\r\n6. from Inventory tree MB3 remove from Session -  ALL Wells well list.\r\n7, MB3 on inmemory pointset and Remove from Session\r\n8. this DSR appeared.\r\n\r\nActual Results:\r\nDSR appeared\r\n\r\nExpected Results:\r\nNo DSR....\r\n\r\nAdditional Information:\r\nThis is a G1 SQLPLus instance of the dataset...  there is no ability to use an IP. So the coord reference systems is still in Lat Longs.\r\n	alex.page@halliburton.com	SupportAssistant-v1.0-GUI	10-02-2017/SA_HBL2455_DecisionSpace_Geosciences-10-02-2017_093324.zip	HBL2455	Windows 7	amd64	6.1	t
SA_SurkovMV_DecisionSpace_Geosciences-10-03-2017_123715	2017-10-03 04:37:42.793	SurkovMV-Dell7910	10.253.93.157	DSG	10ep.3	/apps/DSG10ep.3			f	Description of the Issue:\n\n\nSteps to Reproduce this issue:\n1.\n2.\n3.\n\nActual Results:\n\n\nExpected Results:\n\n\nAdditional Information:\n\n	mikhail.surkov@lukoil.com	SupportAssistant-v1.0-GUI	10-03-2017/SA_SurkovMV_DecisionSpace_Geosciences-10-03-2017_123715.zip	SurkovMV	Linux	amd64	2.6.32-573.el6.x86_64	t
SA_atariq_DecisionSpace_Geosciences-10-04-2017_132444	2017-10-04 14:26:35.276	ahevlrgs01	172.26.56.23	DSG	10ep.2	/Landmark/DSG10ep.2			f	Description of the Issue:\n\n\nSteps to Reproduce this issue:\n1.\n2.\n3.\n\nActual Results:\n\n\nExpected Results:\n\n\nAdditional Information:\n\n	tomj@mycompany.com	SupportAssistant-v1.0-GUI	10-04-2017/SA_atariq_DecisionSpace_Geosciences-10-04-2017_132444.zip	atariq	Linux	amd64	2.6.32-504.el6.x86_64	t
SA_H123780_DecisionSpace_Geosciences-10-05-2017_121239	2017-10-05 13:22:00.823	mwks292982	34.150.21.152	DSG	10ep.4	C:\\Landmark\\DSG10ep.4			f	Description of the Issue:\r\n\r\n\r\nThis is a TEST from Marie Knappenberger's computer. This is only a Test.\r\nWhoever picks this up, can you drop Marie an email. \r\nI'd like to understand specifically what you get in your inbox.\r\n\r\n\r\n\r\nSteps to Reproduce this issue:\r\n1.\r\n2.\r\n3.\r\n\r\nActual Results:\r\n\r\n\r\nExpected Results:\r\n\r\n\r\nAdditional Information:\r\n\r\n	marie.knappenberger@halliburton.com	SupportAssistant-v1.0-GUI	10-05-2017/SA_H123780_DecisionSpace_Geosciences-10-05-2017_121239.zip	H123780	Windows 10	amd64	10.0	t
SA_H152342_DecisionSpace_Geosciences-10-06-2017_131956	2017-10-06 14:23:45.758	WKS392664	34.54.50.64	DSG	10ep.4.03	C:\\Landmark\\DSG10ep.4		Crash	f	Description of the Issue:\r\nI had left a session running since yesterday and then the SRL went down for a couple hours this morning and then i went to go see why there was no popup notifiying me the db connection was lost and then it crashed, i think.\r\n\r\nSteps to Reproduce this issue:\r\n1.\r\n2.\r\n3.\r\n\r\nActual Results:\r\n\r\n\r\nExpected Results:\r\n\r\n\r\nAdditional Information:\r\n\r\n	megan.ganak@halliburton.com	SupportAssistant-v1.0-GUI	10-06-2017/SA_H152342_DecisionSpace_Geosciences-10-06-2017_131956.zip	H152342	Windows 10	amd64	10.0	t
SA_immadsh_DecisionSpace_Geosciences-10-07-2017_110813	2017-10-07 12:13:14.731	mocsrvora01.hux.murphyoilcorp.com	10.100.1.206	DSG	10ep.3	/apps/linux/OpenWorks/r5000.10.6/DSG10ep.3		Performance	f	Description of the Issue:\n\n\nSteps to Reproduce this issue:\n1.\n2.\n3.\n\nActual Results:\n\n\nExpected Results:\n\n\nAdditional Information:\n\n	shan_immadi@murphyoilcorp.com	SupportAssistant-v1.0-GUI	10-07-2017/SA_immadsh_DecisionSpace_Geosciences-10-07-2017_110813.zip	immadsh	Linux	amd64	2.6.32-696.3.1.el6.x86_64	t
SA_H152342_DecisionSpace_Geosciences-10-10-2017_085619	2017-10-10 09:58:42.985	WKS392664	34.54.50.64	DSG	10ep.4.03	C:\\Landmark\\DSG10ep.4	7748	Crash	f	Description of the Issue:\r\nThis is a crash using the megamerge survey in DSG10ep4.03 10/9 4 pm build. In the ADD, i scrolled right and it crashed. WHOMP.\r\n\r\nSteps to Reproduce this issue:\r\n1.\r\n2.\r\n3.\r\n\r\nActual Results:\r\n\r\n\r\nExpected Results:\r\n\r\n\r\nAdditional Information:\r\n\r\n	megan.ganak@halliburton.com	SupportAssistant-v1.0-GUI	10-10-2017/SA_H152342_DecisionSpace_Geosciences-10-10-2017_085619.zip	H152342	Windows 10	amd64	10.0	t
SA_jcharzy_DecisionSpace_Geosciences-10-10-2017_101903	2017-10-10 11:23:03.658	ho48lw0313.conocophillips.net	158.139.58.55	DSG	10ep.3	/apps/ow513/DSG/10ep.3.05.3			f	Description of the Issue:\nHotspot crash after trying to load a new well list that was concurrently loaded with Well List Manager.\n\nSteps to Reproduce this issue:\n1.Load a new well list through Classic Well List manager (while DSG is open)\n2. reinitialize well list in Add Data in DSG\n3. CRASH!\n\n	jon.j.charzynski@conocophillips.com	SupportAssistant-v1.0-GUI	10-10-2017/SA_jcharzy_DecisionSpace_Geosciences-10-10-2017_101903.zip	jcharzy	Linux	amd64	2.6.32-573.1.1.el6.x86_64	t
SA_chh791_DecisionSpace_Geosciences-10-12-2017_143433	2017-10-12 15:36:52.474	C256775DP	10.49.16.63	DSG	10ep.3	C:\\LANDMARK\\DSG10EP3.05.2			f	Description of the Is\r\nDSG hung in the map module while turning layers on and off.\r\nSteps to Reproduce this issue:\r\n1.\r\n2.\r\n3.\r\n\r\nActual Results:\r\n\r\n\r\nExpected Results:\r\n\r\n\r\nAdditional Information:\r\n\r\n	callie.anderson@anadarko.com	SupportAssistant-v1.0-GUI	10-12-2017/SA_chh791_DecisionSpace_Geosciences-10-12-2017_143433.zip	chh791	Windows 10	amd64	10.0	t
SA_jcharzy_DecisionSpace_Geosciences-10-12-2017_161721	2017-10-12 18:08:13.744	ho48lw0313.conocophillips.net	158.139.58.55	DSG	10ep.3	/apps/ow513/DSG/10ep.3.05.3		Crash	t	Description of the Issue:\nSame as CASE ID 2330270\n\nAdditional step of filtering the well list name field might be necessary.	jon.j.charzynski@conocophillips.com	SupportAssistant-v1.0-GUI	10-12-2017/SA_jcharzy_DecisionSpace_Geosciences-10-12-2017_161721.zip	jcharzy	Linux	amd64	2.6.32-573.1.1.el6.x86_64	t
SA_aia282_DecisionSpace_Geosciences-10-13-2017_082422	2017-10-13 10:19:30.35	C252250	10.118.40.72	DSG	10ep.3	C:\\LANDMARK\\DSG10EP3.05.2			f	This is for testing purposes only. \r\n\r\nThis is only an example.	brian.smith3@anadarko.com	SupportAssistant-v1.0-GUI	10-13-2017/SA_aia282_DecisionSpace_Geosciences-10-13-2017_082422.zip	aia282	Windows 10	amd64	10.0	t
SA_h100379_DecisionSpace_Geosciences-10-16-2017_064012	2017-10-16 07:42:36.947	MWKS410519	34.54.6.218	DSG	10ep.4	C:\\Landmark\\DSG10ep.4			f	This is a test. Please ignore	abdullah.tariq@halliburton.com	SupportAssistant-v1.0-GUI	10-16-2017/SA_h100379_DecisionSpace_Geosciences-10-16-2017_064012.zip	h100379	Windows 7	amd64	6.1	t
SA_r5000_DecisionSpace_Geosciences-10-16-2017_101018	2017-10-16 08:20:45.904	MWKS466036	192.168.1.1	DSG	10ep.4	C:\\Landmark\\DSG10ep.4			f	Description of the Issue:\n\n\nSteps to Reproduce this issue:\n1.\n2.\n3.\n\nActual Results:\n\n\nExpected Results:\n\n\nAdditional Information:\n\n	vivianeferreirada.silva@halliburton.com	SupportAssistant-v1.0-GUI	10-16-2017/SA_r5000_DecisionSpace_Geosciences-10-16-2017_101018.zip	r5000	Windows 7	amd64	6.1	t
SA_H182811_DecisionSpace_Geosciences-10-17-2017_115436	2017-10-17 02:26:29.981	ILINKSYS-313	134.132.119.6	DSG	5000.10.0.05	c:\\Landmark\\DecisionSpace5000.10.0.05			f	This is a test. please ignore.	test@test.com	SupportAssistant-v1.0-GUI	10-17-2017/SA_H182811_DecisionSpace_Geosciences-10-17-2017_115436.zip	H182811	Windows 7	amd64	6.1	f
SA_H182811_DecisionSpace_Geosciences-10-17-2017_122458	2017-10-17 02:57:02.746	ILINKSYS-313	134.132.119.6	DSG	5000.10.0.05	c:\\Landmark\\DecisionSpace5000.10.0.05			f	This is a testing. Please ignore this.	test@test.com	SupportAssistant-v1.0-GUI	10-17-2017/SA_H182811_DecisionSpace_Geosciences-10-17-2017_122458.zip	H182811	Windows 7	amd64	6.1	f
SA_H182811_DecisionSpace_Geosciences-10-17-2017_123117	2017-10-17 03:03:17.183	ILINKSYS-313	134.132.119.6	DSG	5000.10.0.05	c:\\Landmark\\DecisionSpace5000.10.0.05			f	This is a test. Please ignore this.	test@test.com	SupportAssistant-v1.0-GUI	10-17-2017/SA_H182811_DecisionSpace_Geosciences-10-17-2017_123117.zip	H182811	Windows 7	amd64	6.1	f
SA_H182811_DecisionSpace_Geosciences-10-17-2017_123432	2017-10-17 03:06:31.583	ILINKSYS-313	134.132.119.6	DSG	5000.10.0.05	c:\\Landmark\\DecisionSpace5000.10.0.05			f	This is a test. please ignore this.	test@test.com	SupportAssistant-v1.0-GUI	10-17-2017/SA_H182811_DecisionSpace_Geosciences-10-17-2017_123432.zip	H182811	Windows 7	amd64	6.1	f
SA_H182811_DecisionSpace_Geosciences-10-17-2017_123616	2017-10-17 03:09:41.75	ILINKSYS-313	134.132.119.6	DSG	5000.10.0.05	c:\\Landmark\\DecisionSpace5000.10.0.05			f	This is a test. please ignore this.	test@test.com	SupportAssistant-v1.0-GUI	10-17-2017/SA_H182811_DecisionSpace_Geosciences-10-17-2017_123616.zip	H182811	Windows 7	amd64	6.1	f
SA_H182811_DecisionSpace_Geosciences-10-17-2017_124640	2017-10-17 03:21:18.739	ILINKSYS-313	134.132.119.6	DSG	5000.10.0.05	c:\\Landmark\\DecisionSpace5000.10.0.05			f	This is a test. Please ignore this.	test@test.com	SupportAssistant-v1.0-GUI	10-17-2017/SA_H182811_DecisionSpace_Geosciences-10-17-2017_124640.zip	H182811	Windows 7	amd64	6.1	f
SA_H182811_DecisionSpace_Geosciences-10-17-2017_125512	2017-10-17 03:27:04.978	ILINKSYS-313	134.132.119.6	DSG	5000.10.0.05	c:\\Landmark\\DecisionSpace5000.10.0.05			f	This is a test. Please ignore this.	test@test.com	SupportAssistant-v1.0-GUI	10-17-2017/SA_H182811_DecisionSpace_Geosciences-10-17-2017_125512.zip	H182811	Windows 7	amd64	6.1	f
SA_H182811_DecisionSpace_Geosciences-10-17-2017_130254	2017-10-17 03:39:21.977	ILINKSYS-313	134.132.119.6	DSG	5000.10.0.05	c:\\Landmark\\DecisionSpace5000.10.0.05			f	This is a test. Please ignore this.	test@test.com	SupportAssistant-v1.0-GUI	10-17-2017/SA_H182811_DecisionSpace_Geosciences-10-17-2017_130254.zip	H182811	Windows 7	amd64	6.1	t
SA_h100379_DecisionSpace_Geosciences-10-17-2017_064348	2017-10-17 07:47:44.457	MWKS410519	34.54.6.218	DSG	10ep.4	C:\\Landmark\\DSG10ep.4			f	This is a test issue. Please ignore and close the ticket. Thanks!	abdullah.tariq@halliburton.com	SupportAssistant-v1.0-GUI	10-17-2017/SA_h100379_DecisionSpace_Geosciences-10-17-2017_064348.zip	h100379	Windows 7	amd64	6.1	f
SA_SayfutdinovRS_DecisionSpace_Geosciences-10-17-2017_192813	2017-10-17 09:43:33.324	SayfutdinovRSh	10.253.93.3	DSG	10ep.3	/apps/DSG10ep.3			f	Description of the Issue:\n\n\nSteps to Reproduce this issue:\n1.\n2.\n3.\n\nActual Results:\n\n\nExpected Results:\n\n\nAdditional Information:\n\n	rauf.sayfytdinov@lukoil.com	SupportAssistant-v1.0-GUI	10-17-2017/SA_SayfutdinovRS_DecisionSpace_Geosciences-10-17-2017_192813.zip	SayfutdinovRS	Linux	amd64	2.6.32-573.el6.x86_64	f
SA_tallid_DecisionSpace_Geosciences-10-18-2017_140327	2017-10-18 02:07:00.546	pertcebl19.conocophillips.net	159.163.220.158	DSG	10ep.3	/apps/ow513/DSG/10ep.3.05.3		Crash	t	Description of the Issue:\nCrashed when manually saving\n\nSteps to Reproduce this issue:\n1.Save session\n2.\n3.\n\nActual Results:\ncrash\n\nExpected Results:\nto save\n\nAdditional Information:\nnew session made days ago\n	david.tallis@conocophillips.com	SupportAssistant-v1.0-GUI	10-18-2017/SA_tallid_DecisionSpace_Geosciences-10-18-2017_140327.zip	tallid	Linux	amd64	2.6.32-696.el6.x86_64	t
SA_H111868_DecisionSpace_Geosciences-11-10-2017_110930	2017-11-10 12:37:27.011	WKS328897	34.52.25.41	DSG	10ep.4.03	G:\\Landmark\\DSG10ep.4			f	Description of the Issue:\n\n\nSteps to Reproduce this issue:\n1.\n2.\n3.\n\nActual Results:\n\n\nExpected Results:\n\n\nAdditional Information:\n\n	shameem.siddiqui@halliburton.com	SupportAssistant-v1.0-GUI	11-10-2017/SA_H111868_DecisionSpace_Geosciences-11-10-2017_110930.zip	H111868	Windows 7	amd64	6.1	t
SA_dsgtester_DecisionSpace_Geosciences-10-20-2017_093338	2017-10-20 10:36:42.931	RHEL66-2.BPL48.R1P1.IENERGYCLOUD.SOLUTIONS	10.215.129.2	DSG	10ep.3	/apps/DSG10ep3.5.2			f	Description of the Issue:\nOpened an existing session\n\nSteps to Reproduce this issue:\n1. Open a session\n2.\n3.\n\nActual Results:\nhotspot crash\n\nExpected Results:\nsession would load\n\nAdditional Information:\n\n	jane.glenn@halliburton.com	SupportAssistant-v1.0-GUI	10-20-2017/SA_dsgtester_DecisionSpace_Geosciences-10-20-2017_093338.zip	dsgtester	Linux	amd64	2.6.32-696.6.3.el6.x86_64	t
SA_murths_DecisionSpace_Geosciences-10-20-2017_153958	2017-10-20 16:46:31.136	hotrlw55	158.139.32.155	DSG	10ep.4.03	/apps/ow516b/DSG/10ep.4.03b11			f	Description of the Issue:\nCrash while doing 2D fault interpretation\n\nSteps to Reproduce this issue:\n1. Launched DSG - Australia project\n2. In the inventory tree included all 2D lines available along with Seismic data\n3. using arbitrary line option, selected multiple lines\n4. Created few faults (around 4-5) and started interpreting.\n5. Launched Seismic trace calculations -> attribute generation\n6. Selected all available 2D lines and submitted a job to generate Reflection strength\n7.  Started continuing 2D line interpretation\n\nDSG crashes!\n\n\nActual Results:\n\n\nExpected Results:\n\n\nAdditional Information:\n\n	sriram.murthy@halliburton.com	SupportAssistant-v1.0-GUI	10-20-2017/SA_murths_DecisionSpace_Geosciences-10-20-2017_153958.zip	murths	Linux	amd64	2.6.32-573.1.1.el6.x86_64	t
SA_jabaker_DecisionSpace_Geosciences-10-23-2017_152724	2017-10-23 03:30:06.143	kullws01.conocophillips.net	159.163.244.220	DSG	10ep.3	/apps/ow513/DSG/10ep.3.05.3		Stability	f	Description of the Issue:\nSession crashed while importing horizons via list. \n\nSteps to Reproduce this issue:\n1.\n2.\n3.\n\nActual Results:\n\n\nExpected Results:\n\n\nAdditional Information:\n\n	jesse.a.baker@conocophillips.com	SupportAssistant-v1.0-GUI	10-23-2017/SA_jabaker_DecisionSpace_Geosciences-10-23-2017_152724.zip	jabaker	Linux	amd64	2.6.32-573.1.1.el6.x86_64	t
SA_atariq_DecisionSpace_Geosciences-10-24-2017_125819	2017-10-24 14:01:35.651	ahevlrgs01	172.26.56.23	DSG	10ep.2	/Landmark/DSG10ep.2			t	\n3.\n\nActual Results:\n\n\nExpected Results:\n\n\nAdditional Information:\n\n	tomj@mycompany.com	SupportAssistant-v1.0-GUI	10-24-2017/SA_atariq_DecisionSpace_Geosciences-10-24-2017_125819.zip	atariq	Linux	amd64	2.6.32-504.el6.x86_64	t
SA_hbl2777_OW_Runtime-10-27-2017_134621	2017-10-27 08:53:22.586	WKS387987	34.159.21.104	OW Runtime	5000.10.5.0	F:\\Landmark\\OpenWorks		Usability	f	Description of the Issue:\n\n\nSteps to Reproduce this issue:\n1.\n2.\n3.\n\nActual Results:\n\n\nExpected Results:\n\n\nAdditional Information:\n\n	dcrabb@lgc.com	SupportAssistant-v1.0-GUI	10-27-2017/SA_hbl2777_OW_Runtime-10-27-2017_134621.zip	hbl2777	Windows 7	amd64	6.1	t
SA_KaskovNR_DecisionSpace_Geosciences-10-31-2017_165319	2017-10-31 09:59:03.963	KaskovNR-HPZ820	10.253.93.11	DSG	10ep.3	/apps/DSG10ep.3			f	Description of the Issue:\n\n\nSteps to Reproduce this issue:\n1.\n2.\n3.\n\nActual Results:\n\n\nExpected Results:\n\n\nAdditional Information:\n\n	nikita.kaskov@lukoil.com	SupportAssistant-v1.0-GUI	10-31-2017/SA_KaskovNR_DecisionSpace_Geosciences-10-31-2017_165319.zip	KaskovNR	Linux	amd64	2.6.32-573.el6.x86_64	t
SA_KaskovNR_DecisionSpace_Geosciences-10-31-2017_165654	2017-10-31 09:59:34.272	KaskovNR-HPZ820	10.253.93.11	DSG	10ep.3	/apps/DSG10ep.3			f	Description of the Issue:\n\n\nSteps to Reproduce this issue:\n1.\n2.\n3.\n\nActual Results:\n\n\nExpected Results:\n\n\nAdditional Information:\n\n	nikita.kaskov@lukoil.com	SupportAssistant-v1.0-GUI	10-31-2017/SA_KaskovNR_DecisionSpace_Geosciences-10-31-2017_165654.zip	KaskovNR	Linux	amd64	2.6.32-573.el6.x86_64	t
SA_delapal_DecisionSpace_Geosciences-10-31-2017_130047	2017-10-31 14:06:04.004	moclx82.hux.murphyoilcorp.com	10.200.129.82	DSG	10ep.3	/apps/linux/OpenWorks/r5000.10.6/DSG10ep.3	15040	Crash	f	Description of the Issue:I was workinig on making a velocity model and for a time-depth conversion but the velocity volume was not found (I do not know why or how) \n\n\nSteps to Reproduce this issue:\n1.I have not tried to reproduce it yet\n2.\n3.\n\nActual Results:N/A\n\n\nExpected Results:N/A\n\n\nAdditional Information: System is unstable in general\n\n	alejandro_delapena@murphyoilcorp.com	SupportAssistant-v1.0-GUI	10-31-2017/SA_delapal_DecisionSpace_Geosciences-10-31-2017_130047.zip	delapal	Linux	amd64	2.6.32-696.3.1.el6.x86_64	t
SA_ramirmi_DecisionSpace_Geosciences-10-31-2017_161730	2017-10-31 20:21:20.312	antcelw0211.conocophillips.net	10.25.48.41	DSG	10ep.3	/apps/ow513/DSG/10ep.3.05.3			f	Description of the Issue: create new session and was in the process of adding data\n\n\nSteps to Reproduce this issue:\n1. Create new session\n2. Add faults \n3. Go back to add data window to add more faults. Collapse\n\nActual Results: dsg shut down\n\n\nExpected Results: add more faults to session\n\n\nAdditional Information:\n\n	marina.i.ramirez@conocophillips.com	SupportAssistant-v1.0-GUI	10-31-2017/SA_ramirmi_DecisionSpace_Geosciences-10-31-2017_161730.zip	ramirmi	Linux	amd64	2.6.32-696.el6.x86_64	t
SA_pbgexp_DecisionSpace_Geosciences-11-06-2017_082716	2017-11-06 09:41:53.054	c247888.wks.anadarko.com	10.118.80.66	DSG	10ep.3	/site/gngapps/lgc/r5000.10.6/Linux/DSG10ep.3.05.3_p		Hung-up	t	Description of the Issue:\nDSG Session does not open\n\n\nSteps to Reproduce this issue:\n1.restarted Linux machine\n2.\n3.\n\nActual Results:\nSame\n\n\nExpected Results:\n\n\nAdditional Information:\n\n	peter.gamwell@anadarko.com	SupportAssistant-v1.0-GUI	11-06-2017/SA_pbgexp_DecisionSpace_Geosciences-11-06-2017_082716.zip	pbgexp	Linux	amd64	2.6.32-504.8.1.el6.x86_64	t
SA_uid0927554_DecisionSpace_Geosciences-11-06-2017_174908	2017-11-06 11:56:01.474	t4vaf0100c-07.ad04.eni.intranet	10.110.135.59	DSG	10ep.3	/sw/vaf/lgc/DecisionSpace/10ep.3.05.4b		Client Testing	f	Description of the Issue: This is a test of the 3/05.4 Beta at ENI HQ.\n\n\nSteps to Reproduce this issue:\n1.\n2.\n3.\n\nActual Results:\n\n\nExpected Results:\n\n\nAdditional Information:\n\n	abayomi.olufowoshe@halliburton.com	SupportAssistant-v1.0-GUI	11-06-2017/SA_uid0927554_DecisionSpace_Geosciences-11-06-2017_174908.zip	uid0927554	Linux	amd64	2.6.32-642.el6.x86_64	t
SA_H183421_DecisionSpace_Geosciences-11-06-2017_132144	2017-11-06 14:34:38.61	WKS380658	34.54.50.210	DSG	10ep.4.03	C:\\Landmark\\DSG10ep.4		Stability	f	Description of the Issue:\r\nWhen tried to load a Geoshaper into the session - Mapv View -> Time, a DecisionSpace Recovery Dialog prompted up with the message:\r\n"An unexpected error has ocurred" / java.lang.RuntimeException / SEVERE ERROR CAUGHT..."\r\n\r\nSteps to Reproduce this issue:\r\n1. New Session with OW TEAPOT_DOME -> IP GIS_AG, ARGF\r\n2. Add Geoshaper AA1teapot_AllFeatures, Time into Map View\r\n3. Turn On Geoshaper\r\n\r\nActual Results:\r\nDecisionSpace Recovery Dialog prompted up asking to select an option: (1) Report Issue; (2) Continue Working; or (3) Exit Application.\r\n\r\nExpected Results:\r\nGeoshaper should render in Map View\r\n\r\nAdditional Information:\r\n\r\n	alexander.gonzalez@halliburton.com	SupportAssistant-v1.0-GUI	11-06-2017/SA_H183421_DecisionSpace_Geosciences-11-06-2017_132144.zip	H183421	Windows 7	amd64	6.1	t
SA_yptk1_DecisionSpace_Geosciences-11-08-2017_105604	2017-11-08 12:59:56.749	dnvdcvlp011.anadarko.com	10.135.0.113	DSG	10ep.3	/site/gngapps/lgc/r5000.10.6/Linux/DSG10ep.3.05.3_p			f	Description of the Issue:\nDSG crashed while trying to add a seismic volume to a session.\n\nSteps to Reproduce this issue:\n1.\n2.\n3.\n\nActual Results:\n\n\nExpected Results:\n\n\nAdditional Information:\n\n	philip.king@anadarko.com	SupportAssistant-v1.0-GUI	11-08-2017/SA_yptk1_DecisionSpace_Geosciences-11-08-2017_105604.zip	yptk1	Linux	amd64	2.6.32-642.3.1.el6.x86_64	t
SA_bwn528_DecisionSpace_Geosciences-11-14-2017_170317	2017-11-14 18:07:30.592	c240301.wks.anadarko.com	10.118.80.90	DSG	10ep.3	/site/gngapps/lgc/r5000.10.6/Linux/DSG10ep.3.05.3A		Crash	f	Description of the Issue:\nhit build model on hybrid velocity model\n\nSteps to Reproduce this issue:\n1.used seismic velocity a horizon and top\n2.\n3.\n\nActual Results:\n\n\nExpected Results:\n\n\nAdditional Information:\n\n	wally.partridge@anadarko.com	SupportAssistant-v1.0-GUI	11-14-2017/SA_bwn528_DecisionSpace_Geosciences-11-14-2017_170317.zip	bwn528	Linux	amd64	2.6.32-504.8.1.el6.x86_64	t
SA_adenut_DecisionSpace_Geosciences-11-15-2017_172520	2017-11-15 21:29:30.674	agni.conocophillips.net	10.25.107.75	DSG	10ep.3	/apps/ow513/DSG/10ep.3.05.3		Stability	f	Description of the Issue:\nAttempting to add horizons to DSG session. Application crashed in process of listiing horizons.\n\nSteps to Reproduce this issue:\n1.\n2.\n3.\n\nActual Results:\n\n\nExpected Results:\n\n\nAdditional Information:\n\n	taiwo.adenuga@cop.com	SupportAssistant-v1.0-GUI	11-15-2017/SA_adenut_DecisionSpace_Geosciences-11-15-2017_172520.zip	adenut	Linux	amd64	2.6.32-696.el6.x86_64	t
SA_Scott-New_DecisionSpace_Geosciences-11-21-2017_143847	2017-11-21 16:43:36.867	Scott_Laptop	192.168.11.224	DSG	10ep.3	C:\\Landmark\\DSG10E~1		Usability	t	Description of the Issue:\r\ncannot get cube view to work properly; error log says \r\n\r\n\r\n\r\nActual Results: cannot display easily in cube view. \r\n\r\n\r\nExpected Results: Seismic works just fine in another version of EP \r\n\r\n\r\nAdditional Information: (from onsite account manager Travis Hagler)\r\n\r\nnew install; error log says loop exception eclipse	travis.hagler@halliburton.com	SupportAssistant-v1.0-GUI	11-21-2017/SA_Scott-New_DecisionSpace_Geosciences-11-21-2017_143847.zip	Scott-New	Windows 7	amd64	6.1	t
SA_putrarp_DecisionSpace_Geosciences-11-29-2017_161435	2017-11-29 04:19:15.113	jalx11.conocophillips.net	159.163.156.101	DSG	10ep.3	/apps/ow513/DSG/10ep.3.05.3		Crash	f	Description of the Issue: suddenly crash and lost the session\n\n\nSteps to Reproduce this issue:\n1. color fill setting on GR track\n2. click ok\n3. crash\n\nActual Results: 2nd attempt to make a collor fill and still experience similar problem\n\n\nExpected Results: fix the bug that causing such crash\n\n\nAdditional Information: project EXP_SUMSEL_P\n\n	rizki.p.putra@conocophillips.com	SupportAssistant-v1.0-GUI	11-29-2017/SA_putrarp_DecisionSpace_Geosciences-11-29-2017_161435.zip	putrarp	Linux	amd64	2.6.32-573.1.1.el6.x86_64	t
SA_hbl2471_DecisionSpace_Geosciences-11-29-2017_134734	2017-11-29 15:51:22.809	ABEGEMANW72	134.132.140.152	DSG	10ep.4.03	C:\\Landmark\\DSG10ep.4			f	Description of the Issue:\r\nDSR upon launching DSG\r\n\r\nSteps to Reproduce this issue:\r\n1.Launch DSG\r\n\r\nActual Results:\r\n\r\n\r\nExpected Results:\r\n\r\n\r\nAdditional Information:\r\n\r\n	abegeman@lgc.com	SupportAssistant-v1.0-GUI	11-29-2017/SA_hbl2471_DecisionSpace_Geosciences-11-29-2017_134734.zip	hbl2471	Windows 7	amd64	6.1	t
SA_mlijtmaer_DecisionSpace_Geosciences-12-01-2017_100900	2017-12-01 08:12:34.631	wk525112	127.0.0.1	DSG	10ep.3	/apps/R5000/OW5000/5000.10.6_el6/DSG10ep.3		Crash	t	Description of the Issue:\n\n\nSteps to Reproduce this issue:\n1.\n2.\n3.\n\nActual Results:\n\n\nExpected Results:\n\n\nAdditional Information:\n\n	mauro.lijtmaer@pampaenergia.com	SupportAssistant-v1.0-GUI	12-01-2017/SA_mlijtmaer_DecisionSpace_Geosciences-12-01-2017_100900.zip	mlijtmaer	Linux	amd64	2.6.32-573.el6.x86_64	t
SA_mlijtmaer_DecisionSpace_Geosciences-12-01-2017_152924	2017-12-01 13:32:46.029	wk525112	127.0.0.1	DSG	10ep.3.05.4	/apps/R5000/OW5000/5000.10.6_el6/DSG10ep.3.05.4	3083	Crash	f	Description of the Issue:\nRestoring session\n\nSteps to Reproduce this issue:\n1.\n2.\n3.\n\nActual Results:\n\n\nExpected Results:\n\n\nAdditional Information:\n\n	mauro.lijtmaer@pampaenergia.com	SupportAssistant-v1.0-GUI	12-01-2017/SA_mlijtmaer_DecisionSpace_Geosciences-12-01-2017_152924.zip	mlijtmaer	Linux	amd64	2.6.32-573.el6.x86_64	t
SA_atariq_DecisionSpace_Geosciences-12-04-2017_063922	2017-12-04 07:42:37.524	ahevlrgs01	172.26.56.23	DSG	10ep.2	/Landmark/DSG10ep.2			f	This is a test. Please ignore.	abdullah.tariq@halliburton.com	SupportAssistant-v1.0-GUI	12-04-2017/SA_atariq_DecisionSpace_Geosciences-12-04-2017_063922.zip	atariq	Linux	amd64	2.6.32-504.el6.x86_64	t
SA_atariq_DecisionSpace_Geosciences-12-04-2017_064127	2017-12-04 07:46:13.029	ahevlrgs01	172.26.56.23	DSG	10ep.2	/Landmark/DSG10ep.2			f	This is a test. Please ignore.	abdullah.tariq@halliburton.com	SupportAssistant-v1.0-GUI	12-04-2017/SA_atariq_DecisionSpace_Geosciences-12-04-2017_064127.zip	atariq	Linux	amd64	2.6.32-504.el6.x86_64	t
SA_h100379_DecisionSpace_Geosciences-12-04-2017_072512	2017-12-04 08:28:51.65	MWKS410519	34.54.6.218	DSG	10ep.3	C:\\Landmark\\DSG10ep.3		Crash	t	please ignore	abdullah.tariq@halliburton.com	SupportAssistant-v1.0-GUI	12-04-2017/SA_h100379_DecisionSpace_Geosciences-12-04-2017_072512.zip	h100379	Windows 7	amd64	6.1	t
SA_h100379_DecisionSpace_Geosciences-12-06-2017_104745	2017-12-06 11:51:28.548	MWKS410519	34.54.6.218	DSG	10ep.4	C:\\Landmark\\DSG10ep.4			f	Description of the Issue:\n\n\nSteps to Reproduce this issue:\n1.\n2.\n3.\n\nActual Results:\n\n\nExpected Results:\n\n\nAdditional Information:\n\n	abdullah.tariq@halliburton.com	SupportAssistant-v1.0-GUI	12-06-2017/SA_h100379_DecisionSpace_Geosciences-12-06-2017_104745.zip	h100379	Windows 7	amd64	6.1	t
SA_H134826_DecisionSpace_Geosciences-12-12-2017_115838	2017-12-12 07:04:22.118	WIN-771NMEE0HJV	10.134.23.13	DSG	10ep.4.03	C:\\Landmark\\DSG10ep.4		Killed	f	Description of the Issue:\r\ntried running seismic attribute on oec workspace\r\n\r\nSteps to Reproduce this issue:\r\n1.\r\n2.\r\n3.\r\n\r\nActual Results:\r\nhotspot?\r\n\r\nExpected Results:\r\n\r\n\r\nAdditional Information:\r\n\r\n	thomas.otoole@pinntech.com	SupportAssistant-v1.0-GUI	12-12-2017/SA_H134826_DecisionSpace_Geosciences-12-12-2017_115838.zip	H134826	Windows Server 2008 R2	amd64	6.1	t
SA_ag70990_DecisionSpace_Geosciences-12-12-2017_144716	2017-12-12 08:50:39.549	t4vaf0100b-03.ad04.eni.intranet	10.110.135.69	DSG	10ep.3.05.2	/sw/vaf/lgc/DecisionSpace/10ep.3.05.2			f	Description of the Issue:\n\n\nSteps to Reproduce this issue:\n1.\n2.\n3.\n\nActual Results:\n\n\nExpected Results:\n\n\nAdditional Information:\n\n	gianna.pompadoro@eni.com	SupportAssistant-v1.0-GUI	12-12-2017/SA_ag70990_DecisionSpace_Geosciences-12-12-2017_144716.zip	ag70990	Linux	amd64	2.6.32-642.el6.x86_64	t
SA_uid0922194_DecisionSpace_Geosciences-12-12-2017_151412	2017-12-12 09:22:03.48	t4vaf0100b-03.ad04.eni.intranet	10.110.135.69	DSG	10ep.3.05.2	/sw/vaf/lgc/DecisionSpace/10ep.3.05.2		Crash	f	Description of the Issue: it crashed after opening a contour map\n\n\nSteps to Reproduce this issue:\n1.Open decision space\n2.Open the contour map\n3.CRASH!!!\n\nActual Results:\nCRASH!!! Everything is blocked and couldn't click anywhere\n\nExpected Results:\nIt should't crash\n\nAdditional Information:\n\n	marco.fonnesu2@eni.com	SupportAssistant-v1.0-GUI	12-12-2017/SA_uid0922194_DecisionSpace_Geosciences-12-12-2017_151412.zip	uid0922194	Linux	amd64	2.6.32-642.el6.x86_64	t
SA_uid0922194_DecisionSpace_Geosciences-12-12-2017_152200	2017-12-12 09:28:19.194	t4vaf0100b-03.ad04.eni.intranet	10.110.135.69	DSG	10ep.3.05.2	/sw/vaf/lgc/DecisionSpace/10ep.3.05.2			f	Description of the Issue:\n\n\nSteps to Reproduce this issue:\n1.\n2.\n3.\n\nActual Results:\n\n\nExpected Results:\n\n\nAdditional Information:\n\n	marco.fonnesu2@eni.com	SupportAssistant-v1.0-GUI	12-12-2017/SA_uid0922194_DecisionSpace_Geosciences-12-12-2017_152200.zip	uid0922194	Linux	amd64	2.6.32-642.el6.x86_64	t
SA_h100379_DecisionSpace_Geosciences-01-02-2018_135611	2018-01-02 15:00:26.516	MWKS410519	34.54.6.218	DSG	10ep.3	C:\\Landmark\\DSG10ep.3		Performance	t	This is a test case. Please ignore.	abdullah.tariq@halliburton.com	SupportAssistant-v1.0-GUI	01-02-2018/SA_h100379_DecisionSpace_Geosciences-01-02-2018_135611.zip	h100379	Windows 7	amd64	6.1	t
SA_uid0699589_DecisionSpace_Geosciences-12-12-2017_184635	2017-12-12 12:51:56.106	t4vaf0100b-03.ad04.eni.intranet	10.110.135.69	DSG	10ep.3.05.2	/sw/vaf/lgc/DecisionSpace/10ep.3.05.2			f	Description of the Issue:\nDecision space was frozen\n\nSteps to Reproduce this issue:\n1. Closed the session\n2. Reopened the session \n3.\n\nActual Results:\n\nExpected Results:\n\n\nAdditional Information:\n\n	quynh.nguyen@eni.com	SupportAssistant-v1.0-GUI	12-12-2017/SA_uid0699589_DecisionSpace_Geosciences-12-12-2017_184635.zip	uid0699589	Linux	amd64	2.6.32-642.el6.x86_64	t
SA_moshecc_DecisionSpace_Geosciences-12-13-2017_021153	2017-12-12 14:18:00.746	jalx84.conocophillips.net	159.163.156.38	DSG	10ep.3	/apps/ow513/DSG/10ep.3.05.3		Usability	t	Description of the Issue:\nIn previsous versions, DSG would run in VNC and "NoMachine" sessions.\nIn this version, when running from VNC or NoMachine sessions, the\nDSG splash screen shows, but initial "session" window appears empty, then disappears.\n\n\nSteps to Reproduce this issue:\n1. Start DSG from a VNC or NoMachine session\n2.\n3.\n\nActual Results:\nSession crashes\n\nExpected Results:\nSession starts\n\nAdditional Information:\n\n	chuck.c.mosher@conocophillips.com	SupportAssistant-v1.0-GUI	12-13-2017/SA_moshecc_DecisionSpace_Geosciences-12-13-2017_021153.zip	moshecc	Linux	amd64	2.6.32-696.el6.x86_64	t
SA_admint_DecisionSpace_Geosciences-12-15-2017_113210	2017-12-15 12:38:51.686	houhpclp002.anadarko.com	10.50.24.42	DSG	10ep.3.05.4	/site/gngapps/lgc/r5000.10.6/Linux/DSG10ep.3.05.4			f	Description of the Issue:\n\n\nSteps to Reproduce this issue:\n1.\n2.\n3.\n\nActual Results:\n\n\nExpected Results:\n\n\nAdditional Information:\n\n	kim.darton@anadarko.com	SupportAssistant-v1.0-GUI	12-15-2017/SA_admint_DecisionSpace_Geosciences-12-15-2017_113210.zip	admint	Linux	amd64	2.6.32-504.8.1.el6.x86_64	t
SA_H140675_DecisionSpace_Geosciences-12-18-2017_102151	2017-12-17 22:55:53.102	MWKS424638	34.183.170.64	DSG	10ep.3.05.4	C:\\Landmark\\DSG10ep.3		Performance	f	Description of the Issue:\r\nI cannot find how to display 3d  grid network\r\n\r\nSteps to Reproduce this issue:\r\n1.Build a DSFP case  from example\r\n2.Run the case\r\n3.\r\n\r\nActual Results:\r\n\r\nI can see the final graph of pressure, but cannot find how to display other properties\r\n\r\nExpected Results:\r\n\r\nDisplay the 3d grid network, including fracture network\r\nDisplay the result data including production data, pressure data.\r\n\r\nAdditional Information:\r\n\r\nNA	jiao.zhang@halliburton.com	SupportAssistant-v1.0-GUI	12-18-2017/SA_H140675_DecisionSpace_Geosciences-12-18-2017_102151.zip	H140675	Windows 7	amd64	6.1	t
SA_tallid_DecisionSpace_Geosciences-12-19-2017_144736	2017-12-19 01:50:41	pertcebl18.conocophillips.net	159.163.220.157	DSG	10ep.3.05.4	/apps/ow513/DSG/10ep.3.05.4	3081	Crash	f	Description of the Issue:\n\n\nSteps to Reproduce this issue:\n1.\n2.\n3.\n\nActual Results:\n\n\nExpected Results:\n\n\nAdditional Information:\n\n	david.tallis@conocophillips.com	SupportAssistant-v1.0-GUI	12-19-2017/SA_tallid_DecisionSpace_Geosciences-12-19-2017_144736.zip	tallid	Linux	amd64	2.6.32-696.el6.x86_64	t
SA_H152342_DecisionSpace_Geosciences-12-20-2017_132534	2017-12-20 14:32:14.045	WKS392664	34.54.50.64	DSG	10ep.4.03	C:\\Landmark\\DSG10ep.4		Crash	f	Description of the Issue:\r\nI left DSG running all morning while working on another computer. When i exited DSG it hotspotted.\r\n\r\nSteps to Reproduce this issue:\r\n1.\r\n2.\r\n3.\r\n\r\nActual Results:\r\n\r\n\r\nExpected Results:\r\n\r\n\r\nAdditional Information:\r\n\r\n	megan.ganak@halliburton.com	SupportAssistant-v1.0-GUI	12-20-2017/SA_H152342_DecisionSpace_Geosciences-12-20-2017_132534.zip	H152342	Windows 10	amd64	10.0	t
SA_kmr996_DecisionSpace_Geosciences-12-20-2017_143621	2017-12-20 15:40:13.968	c236303.wks.anadarko.com	10.118.104.109	DSG	10ep.3.05.4	/site/gngapps/lgc/r5000.10.6/Linux/DSG10ep.3.05.4			f	Description of the Issue:\n\n\nSteps to Reproduce this issue:\n1.\n2.\n3.\n\nActual Results:\n\n\nExpected Results:\n\n\nAdditional Information:\n\n	evan.riddle@anadarko.com	SupportAssistant-v1.0-GUI	12-20-2017/SA_kmr996_DecisionSpace_Geosciences-12-20-2017_143621.zip	kmr996	Linux	amd64	2.6.32-504.8.1.el6.x86_64	t
SA_estaple_DecisionSpace_Geosciences-12-21-2017_141842	2017-12-21 18:22:56.032	antcelw0304.conocophillips.net	10.25.48.54	DSG	10ep.3.05.4	/apps/ow513/DSG/10ep.3.05.4	20706	Crash	f	Description of the Issue:\nI had selected a shapefile and had selected the layer properties when DSG decided to crash unexpectedly.  I have worked with several shapefiles and this particular shapefile in the past.  I also had a time slice showing, which has not caused issues previously.\n\nSteps to Reproduce this issue:\n1.\n2.\n3.\n\nActual Results:\n\n\nExpected Results:\n\n\nAdditional Information:\n\n	evan.staples@cop.com	SupportAssistant-v1.0-GUI	12-21-2017/SA_estaple_DecisionSpace_Geosciences-12-21-2017_141842.zip	estaple	Linux	amd64	2.6.32-696.el6.x86_64	t
SA_hb88584_DecisionSpace_Geosciences-12-26-2017_123621	2017-12-26 13:41:11.877	WKS298193	34.54.50.7	DSG	10ep.4.03	C:\\Landmark\\DSG10ep.4		Killed	f	Description of the Issue:\r\nlockup up loading session in daily build while simultaneously having it open in sandbox\r\n\r\nSteps to Reproduce this issue:\r\n1.\r\n2.\r\n3.\r\n\r\nActual Results:\r\n\r\n\r\nExpected Results:\r\n\r\n\r\nAdditional Information:\r\n\r\n	margaret.scheers@halliburton.com	SupportAssistant-v1.0-GUI	12-26-2017/SA_hb88584_DecisionSpace_Geosciences-12-26-2017_123621.zip	hb88584	Windows 7	amd64	6.1	t
SA_tallid_DecisionSpace_Geosciences-12-28-2017_000152	2017-12-27 19:32:48.202	pertcebl18.conocophillips.net	159.163.220.157	DSG	10ep.3.05.4	/apps/ow513/DSG/10ep.3.05.4	12341	Crash	f	Description of the Issue:\nRuning 3D waveform classification supervised\n\nSteps to Reproduce this issue:\n1.Run 3d waveform classification supervised, from a horizon, with 8 well points\n2.\n3.\n\nActual Results:\nCrash\n\nExpected Results:\nTo complete the process with no issue\n\nAdditional Information:\n\n	david.tallis@conocophillips.com	SupportAssistant-v1.0-GUI	12-28-2017/SA_tallid_DecisionSpace_Geosciences-12-28-2017_000152.zip	tallid	Linux	amd64	2.6.32-696.el6.x86_64	t
SA_tallid_DecisionSpace_Geosciences-12-28-2017_000151	2017-12-27 20:11:11.467	pertcebl22.conocophillips.net	159.163.220.161	DSG	10ep.3.05.4	/apps/ow513/DSG/10ep.3.05.4	53053	Crash	f	Description of the Issue:\nrunning velocity modeller\n\nSteps to Reproduce this issue:\n1.create velocity model\n2.has run many times previously\n3.crash\n\nActual Results:\ncrash\n\nExpected Results:\ncomplete velocity model build\n\nAdditional Information:\n\n	david.tallis@conocophillips.com	SupportAssistant-v1.0-GUI	12-28-2017/SA_tallid_DecisionSpace_Geosciences-12-28-2017_000151.zip	tallid	Linux	amd64	2.6.32-696.el6.x86_64	t
SA_adenut_DecisionSpace_Geosciences-12-28-2017_153651	2017-12-28 19:42:00.697	dewey.conocophillips.net	10.25.107.80	DSG	10ep.3.05.4	/apps/ow513/DSG/10ep.3.05.4	20959	Crash	f	Description of the Issue:\n\n\nSteps to Reproduce this issue:\n1. Add seismic volume to session\n2. In sectionview, click on select inline or crossline icon and select display from mapview \n3. \n\nActual Results:\nDSG freezes/hangs\n\nExpected Results:\nSeismic display of inline or crossline in section view.\n\nAdditional Information:\n\n	taiwo.adenuga@cop.com	SupportAssistant-v1.0-GUI	12-28-2017/SA_adenut_DecisionSpace_Geosciences-12-28-2017_153651.zip	adenut	Linux	amd64	2.6.32-696.el6.x86_64	t
SA_h100379_DecisionSpace_Geosciences-01-02-2018_122829	2018-01-02 14:34:12.303	MWKS410519	34.54.6.218	DSG	10ep.3	C:\\Landmark\\DSG10ep.3		Crash	t	This is a test issue. Please ignore. Thanks!	abdullah.tariq@halliburton.com	SupportAssistant-v1.0-GUI	01-02-2018/SA_h100379_DecisionSpace_Geosciences-01-02-2018_122829.zip	h100379	Windows 7	amd64	6.1	t
SA_h100379_DecisionSpace_Geosciences-01-02-2018_143238	2018-01-02 15:37:32.987	MWKS410519	34.54.6.218	DSG	10ep.3	C:\\Landmark\\DSG10ep.3		Usability	t	I am debugging an issue with the peoplesoft team. Please ignore and close this case. Thanks!	abdullah.tariq@halliburton.com	SupportAssistant-v1.0-GUI	01-02-2018/SA_h100379_DecisionSpace_Geosciences-01-02-2018_143238.zip	h100379	Windows 7	amd64	6.1	t
SA_H100379_DecisionSpace_Geosciences-01-05-2018_070448	2018-01-05 08:08:12.284	MWKS410519	34.54.6.218	DSG	10ep.3	C:\\Landmark\\DSG10ep.3		Test	f	This is a test case. Please ignore.	abdullah.tariq@halliburton.com	SupportAssistant-v1.0-GUI	01-05-2018/SA_H100379_DecisionSpace_Geosciences-01-05-2018_070448.zip	H100379	Windows 7	amd64	6.1	t
